gameid,date,home_team,away_team,goal,primary_assist,secondary_assist,game_situation,game_situation_general,gf_team,gf_team_game_number,ga_team,ga_team_game_number,GF_names,GA_names,GF_skaters,GA_skaters,GF1_name,GF2_name,GF3_name,GF4_name,GF5_name,GF6_name,GA1_name,GA2_name,GA3_name,GA4_name,GA5_name,GA6_name
441992,2019-12-28,Djurgårdens IF,Skellefteå AIK,Marcus Högström,Anton Hedman,Jacob Josefson,5v5,EV,Djurgårdens IF,28,Skellefteå AIK,28,Marcus HögströmAnton HedmanSimon JohanssonDick AxelssonKarri RämöGKJacob Josefson,Petter GranbergJacob AnderssonPontus WiderströmAlbin SundsvikMantas ArmalisGKRickard Hugg,5,5,Marcus Högström,Anton Hedman,Simon Johansson,Dick Axelsson,Karri RämöGK,Jacob Josefson,Petter Granberg,Jacob Andersson,Pontus Widerström,Albin Sundsvik,Mantas ArmalisGK,Rickard Hugg
442090,2020-01-09,Skellefteå AIK,Frölunda HC,Samuel Fagemo,Max Friberg,Joel Lundqvist,5v5,EV,Frölunda HC,31,Skellefteå AIK,31,Jacob MoverareViktor EkbomSamuel FagemoMax FribergJoel LundqvistJohan MattssonGK,Filip BerglundPatrik NorénAlbin SundsvikGustaf LindvallGKJonatan BerggrenRickard Hugg,5,5,Jacob Moverare,Viktor Ekbom,Samuel Fagemo,Max Friberg,Joel Lundqvist,Johan MattssonGK,Filip Berglund,Patrik Norén,Albin Sundsvik,Gustaf LindvallGK,Jonatan Berggren,Rickard Hugg
442093,2020-01-11,HV 71,Skellefteå AIK,Eric Martinsson,Johannes Kinnvall,Christian Sandberg,5v5,EV,HV 71,32,Skellefteå AIK,32,Oscar SundhFilip SandbergChristian SandbergJohannes KinnvallHugo AlnefeltGKEric Martinsson,Philip BrobergAlbin SundsvikGustaf LindvallGKAlbin ErikssonArvid LundbergRickard Hugg,5,5,Oscar Sundh,Filip Sandberg,Christian Sandberg,Johannes Kinnvall,Hugo AlnefeltGK,Eric Martinsson,Philip Broberg,Albin Sundsvik,Gustaf LindvallGK,Albin Eriksson,Arvid Lundberg,Rickard Hugg
441805,2019-09-14,Frölunda HC,Brynäs IF,Simon Hjalmarsson,Joel Lundqvist,Jacob Moverare,5v4,PP,Frölunda HC,1,Brynäs IF,1,Jacob MoverareJoel LundqvistNiklas RubinGKRhett RakhshaniSimon HjalmarssonRyan Lasch,Niclas LundgrenLukas KilströmJoacim ErikssonGKJacob BlomqvistJoachim RohdinNA,5,4,Jacob Moverare,Joel Lundqvist,Niklas RubinGK,Rhett Rakhshani,Simon Hjalmarsson,Ryan Lasch,Niclas Lundgren,Lukas Kilström,Joacim ErikssonGK,Jacob Blomqvist,Joachim Rohdin,NA
441811,2019-09-17,Linköping HC,Brynäs IF,Hampus Larsson,,,3v3,EV,Linköping HC,2,Brynäs IF,2,Axel OttossonHampus LarssonJacob JohanssonGKJimmy AnderssonNANA,Lukas KilströmEmil ForslundJoacim ErikssonGKJaedon DescheneauNANA,3,3,Axel Ottosson,Hampus Larsson,Jacob JohanssonGK,Jimmy Andersson,NA,NA,Lukas Kilström,Emil Forslund,Joacim ErikssonGK,Jaedon Descheneau,NA,NA
441811,2019-09-17,Linköping HC,Brynäs IF,Max Lindroth,Henrik Törnqvist,Andrew Gordon,5v4,PP,Linköping HC,2,Brynäs IF,2,Henrik TörnqvistAndrew GordonNick SörensenJacob JohanssonGKOlle LycksellMax Lindroth,Niclas LundgrenLukas KilströmJoacim ErikssonGKJacob BlomqvistDaniel MannbergNA,5,4,Henrik Törnqvist,Andrew Gordon,Nick Sörensen,Jacob JohanssonGK,Olle Lycksell,Max Lindroth,Niclas Lundgren,Lukas Kilström,Joacim ErikssonGK,Jacob Blomqvist,Daniel Mannberg,NA
441838,2019-10-01,Brynäs IF,Djurgårdens IF,Olle Alsing,Sebastian Strandberg,Michael Haga,5v4,PP,Djurgårdens IF,6,Brynäs IF,5,Anton HedmanNiclas BergforsSebastian StrandbergOlle AlsingMichael HagaNiklas SvedbergGK,Niclas LundgrenLukas KilströmJoacim ErikssonGKJacob BlomqvistJoachim RohdinNA,5,4,Anton Hedman,Niclas Bergfors,Sebastian Strandberg,Olle Alsing,Michael Haga,Niklas SvedbergGK,Niclas Lundgren,Lukas Kilström,Joacim ErikssonGK,Jacob Blomqvist,Joachim Rohdin,NA
441847,2019-10-03,Örebro HK,Brynäs IF,Kristian Näkyvä,Mathias Bromé,Sakari Salminen,5v4,PP,Örebro HK,7,Brynäs IF,6,Daniel Muzito-BagendaMarcus WeinstockSakari SalminenDominik FurchGKKristian NäkyväMathias Bromé,Marcus ErssonJohan AlcénJoacim ErikssonGKJonathan SigaletDaniel MannbergNA,5,4,Daniel Muzito-Bagenda,Marcus Weinstock,Sakari Salminen,Dominik FurchGK,Kristian Näkyvä,Mathias Bromé,Marcus Ersson,Johan Alcén,Joacim ErikssonGK,Jonathan Sigalet,Daniel Mannberg,NA
441852,2019-10-05,Brynäs IF,HV 71,Eric Martinsson,Johannes Kinnvall,Joakim Andersson,5v4,PP,HV 71,9,Brynäs IF,7,Joakim AnderssonJohannes KinnvallJonas GunnarssonGKJuuso IkonenEric MartinssonChristoffer Törngren,Niclas LundgrenLukas KilströmEmil ForslundJoacim ErikssonGKTomi SallinenNA,5,4,Joakim Andersson,Johannes Kinnvall,Jonas GunnarssonGK,Juuso Ikonen,Eric Martinsson,Christoffer Törngren,Niclas Lundgren,Lukas Kilström,Emil Forslund,Joacim ErikssonGK,Tomi Sallinen,NA
441870,2019-10-12,Skellefteå AIK,Brynäs IF,Jonathan Pudas,Joakim Lindström,Oscar Möller,5v3,PP,Skellefteå AIK,10,Brynäs IF,9,Joakim LindströmTom PyattJesper FrödénGustaf LindvallGKOscar MöllerJonathan Pudas,Lukas KilströmSamuel ErssonGKTomi SallinenJoachim RohdinNANA,5,3,Joakim Lindström,Tom Pyatt,Jesper Frödén,Gustaf LindvallGK,Oscar Möller,Jonathan Pudas,Lukas Kilström,Samuel ErssonGK,Tomi Sallinen,Joachim Rohdin,NA,NA
441870,2019-10-12,Skellefteå AIK,Brynäs IF,Oscar Möller,Niclas Burström,Joakim Lindström,5v4,PP,Skellefteå AIK,10,Brynäs IF,9,Niclas BurströmJoakim LindströmTom PyattJesper FrödénGustaf LindvallGKOscar Möller,Lukas KilströmSamuel ErssonGKEric NorinTomi SallinenJoachim RohdinNA,5,4,Niclas Burström,Joakim Lindström,Tom Pyatt,Jesper Frödén,Gustaf LindvallGK,Oscar Möller,Lukas Kilström,Samuel ErssonGK,Eric Norin,Tomi Sallinen,Joachim Rohdin,NA
441886,2019-10-19,Växjö Lakers HC,Brynäs IF,Brendan Shinnimin,Ilari Melart,Emil Pettersson,5v4,PP,Växjö Lakers HC,12,Brynäs IF,11,Linus HögbergRichard GyngeIlari MelartEmil PetterssonBrendan ShinniminViktor AndrénGK,Niclas LundgrenLukas KilströmJohan AlcénJoacim ErikssonGKJacob BlomqvistNA,5,4,Linus Högberg,Richard Gynge,Ilari Melart,Emil Pettersson,Brendan Shinnimin,Viktor AndrénGK,Niclas Lundgren,Lukas Kilström,Johan Alcén,Joacim ErikssonGK,Jacob Blomqvist,NA
441886,2019-10-19,Växjö Lakers HC,Brynäs IF,Ilari Melart,Richard Gynge,Emil Pettersson,5v4,PP,Växjö Lakers HC,12,Brynäs IF,11,Matthew BodieRichard GyngeIlari MelartEmil PetterssonRoman HorakViktor AndrénGK,Emil ForslundJoacim ErikssonGKEric NorinJonathan SigaletDaniel MannbergNA,5,4,Matthew Bodie,Richard Gynge,Ilari Melart,Emil Pettersson,Roman Horak,Viktor AndrénGK,Emil Forslund,Joacim ErikssonGK,Eric Norin,Jonathan Sigalet,Daniel Mannberg,NA
441817,2019-10-29,Brynäs IF,IF Malmö Redhawks,Marcus Björk,Jesper Jensen Aabo,Matias Myttynen,5v4,PP,IF Malmö Redhawks,14,Brynäs IF,14,Marcus BjörkLars VoldenGKMatias MyttynenJesper JensenJesper Jensen AaboFredrik Händemark,Niclas LundgrenLukas KilströmSamuel ErssonGKJoachim RohdinDaniel MannbergNA,5,4,Marcus Björk,Lars VoldenGK,Matias Myttynen,Jesper Jensen,Jesper Jensen Aabo,Fredrik Händemark,Niclas Lundgren,Lukas Kilström,Samuel ErssonGK,Joachim Rohdin,Daniel Mannberg,NA
441904,2019-10-31,IK Oskarshamn,Brynäs IF,Joakim Thelin,Simon Despres,Tyler Kelleher,3v3,EV,IK Oskarshamn,15,Brynäs IF,15,Simon DespresJoakim ThelinTyler KelleherTex WilliamssonGKNANA,Josef IngmanAdam BrodeckiJoacim ErikssonGKDaniel MannbergNANA,3,3,Simon Despres,Joakim Thelin,Tyler Kelleher,Tex WilliamssonGK,NA,NA,Josef Ingman,Adam Brodecki,Joacim ErikssonGK,Daniel Mannberg,NA,NA
441904,2019-10-31,IK Oskarshamn,Brynäs IF,Filiph Engsund,Tyler Kelleher,Felix Schütz,5v4,PP,IK Oskarshamn,15,Brynäs IF,15,Simon DespresArsi PiispanenTyler KelleherFiliph EngsundTex WilliamssonGKFelix Schütz,Niclas LundgrenLukas KilströmJoacim ErikssonGKJacob BlomqvistDaniel MannbergNA,5,4,Simon Despres,Arsi Piispanen,Tyler Kelleher,Filiph Engsund,Tex WilliamssonGK,Felix Schütz,Niclas Lundgren,Lukas Kilström,Joacim ErikssonGK,Jacob Blomqvist,Daniel Mannberg,NA
441922,2019-11-16,Brynäs IF,Skellefteå AIK,Joakim Lindström,Tom Pyatt,Tuomas Kiiskinen,5v4,PP,Skellefteå AIK,18,Brynäs IF,18,Joakim LindströmTom PyattTuomas KiiskinenGustaf LindvallGKOscar MöllerJonathan Pudas,Niclas AndersénJohan AlcénJoacim ErikssonGKJacob BlomqvistJonathan SigaletNA,5,4,Joakim Lindström,Tom Pyatt,Tuomas Kiiskinen,Gustaf LindvallGK,Oscar Möller,Jonathan Pudas,Niclas Andersén,Johan Alcén,Joacim ErikssonGK,Jacob Blomqvist,Jonathan Sigalet,NA
441932,2019-11-21,Luleå HF,Brynäs IF,Niklas Olausson,,,1v0,SO,Luleå HF,19,Brynäs IF,19,Niklas OlaussonNANANANANA,Joacim ErikssonGKNANANANANA,1,0,Niklas Olausson,NA,NA,NA,NA,NA,Joacim ErikssonGK,NA,NA,NA,NA,NA
441951,2019-11-30,HV 71,Brynäs IF,Simon Önerud,Martin Thörnberg,Linus Fröberg,5v4,PP,HV 71,22,Brynäs IF,22,Nils AnderssonMartin ThörnbergSimon ÖnerudHugo AlnefeltGKEric MartinssonLinus Fröberg,Josef IngmanJohan AlcénSamuel ErssonGKJacob BlomqvistJonathan SigaletNA,5,4,Nils Andersson,Martin Thörnberg,Simon Önerud,Hugo AlnefeltGK,Eric Martinsson,Linus Fröberg,Josef Ingman,Johan Alcén,Samuel ErssonGK,Jacob Blomqvist,Jonathan Sigalet,NA
441961,2019-12-05,Rögle BK,Brynäs IF,Daniel Zaar,Taylor Matson,Eric Gelinas,5v4,PP,Rögle BK,24,Brynäs IF,23,Kodie CurranTaylor MatsonRoman WillGKDaniel ZaarEric GelinasTed Brithén,Niclas LundgrenMarcus ErssonEmil ForslundJoacim ErikssonGKJoachim RohdinNA,5,4,Kodie Curran,Taylor Matson,Roman WillGK,Daniel Zaar,Eric Gelinas,Ted Brithén,Niclas Lundgren,Marcus Ersson,Emil Forslund,Joacim ErikssonGK,Joachim Rohdin,NA
441964,2019-12-07,Brynäs IF,Växjö Lakers HC,Marcus Davidsson,Miika Koivisto,Casey Bailey,5v4,PP,Växjö Lakers HC,24,Brynäs IF,24,Marcus DavidssonCasey BaileyRoman HorakBrendan ShinniminViktor AndrénGKMiika Koivisto,Josef IngmanJohan AlcénSamuel ErssonGKJacob BlomqvistJonathan SigaletNA,5,4,Marcus Davidsson,Casey Bailey,Roman Horak,Brendan Shinnimin,Viktor AndrénGK,Miika Koivisto,Josef Ingman,Johan Alcén,Samuel ErssonGK,Jacob Blomqvist,Jonathan Sigalet,NA
441978,2019-12-19,Brynäs IF,Örebro HK,Ryan Stoa,Mathias Bromé,Shane Harper,5v4,PP,Örebro HK,26,Brynäs IF,26,Shane HarperSakari SalminenDominik FurchGKKristian NäkyväMathias BroméRyan Stoa,Niclas LundgrenLukas KilströmJohan AlcénSamuel ErssonGKJacob BlomqvistNA,5,4,Shane Harper,Sakari Salminen,Dominik FurchGK,Kristian Näkyvä,Mathias Bromé,Ryan Stoa,Niclas Lundgren,Lukas Kilström,Johan Alcén,Samuel ErssonGK,Jacob Blomqvist,NA
441985,2019-12-26,Brynäs IF,IK Oskarshamn,Jonas Engström,Joakim Thelin,Johannes Salmonsson,5v4,PP,IK Oskarshamn,27,Brynäs IF,27,Mathew BodieNicklas HeineröJoakim ThelinJonas EngströmJohannes SalmonssonFredrik Petterson-WentzelGK,Niclas AndersénJosef IngmanEmil ForslundSamuel ErssonGKJoachim RohdinNA,5,4,Mathew Bodie,Nicklas Heinerö,Joakim Thelin,Jonas Engström,Johannes Salmonsson,Fredrik Petterson-WentzelGK,Niclas Andersén,Josef Ingman,Emil Forslund,Samuel ErssonGK,Joachim Rohdin,NA
441985,2019-12-26,Brynäs IF,IK Oskarshamn,Tyler Kelleher,,,1v0,SO,IK Oskarshamn,27,Brynäs IF,27,Tyler KelleherNANANANANA,Samuel ErssonGKNANANANANA,1,0,Tyler Kelleher,NA,NA,NA,NA,NA,Samuel ErssonGK,NA,NA,NA,NA,NA
441985,2019-12-26,Brynäs IF,IK Oskarshamn,Tyler Kelleher,Simon Despres,Markus Modigs,5v4,PP,IK Oskarshamn,27,Brynäs IF,27,Simon DespresArsi PiispanenTyler KelleherMarkus ModigsNichlas HardtFredrik Petterson-WentzelGK,Lukas KilströmNiclas AndersénSamuel ErssonGKJoachim RohdinDaniel MannbergNA,5,4,Simon Despres,Arsi Piispanen,Tyler Kelleher,Markus Modigs,Nichlas Hardt,Fredrik Petterson-WentzelGK,Lukas Kilström,Niclas Andersén,Samuel ErssonGK,Joachim Rohdin,Daniel Mannberg,NA
441998,2019-12-28,Leksands IF,Brynäs IF,Patrik Zackrisson,Marek Hrivik,Oskar Lang,5v4,PP,Leksands IF,28,Brynäs IF,28,Oskar LangDaniel GunnarssonMattias KarlssonPatrik ZackrissonMarek HrivikJanne JuvonenGK,Lukas KilströmNiclas AndersénJohan AlcénSamuel ErssonGKJacob BlomqvistNA,5,4,Oskar Lang,Daniel Gunnarsson,Mattias Karlsson,Patrik Zackrisson,Marek Hrivik,Janne JuvonenGK,Lukas Kilström,Niclas Andersén,Johan Alcén,Samuel ErssonGK,Jacob Blomqvist,NA
441998,2019-12-28,Leksands IF,Brynäs IF,Oskar Lang,Emil Heineman,Mattias Göransson,5v4,PP,Leksands IF,28,Brynäs IF,28,Oskar LangEmil HeinemanDaniel Olsson-TrkuljaMattias GöranssonJanne JuvonenGKJonas Ahnelöv,Lukas KilströmNiclas AndersénEmil ForslundSamuel ErssonGKDaniel MannbergNA,5,4,Oskar Lang,Emil Heineman,Daniel Olsson-Trkulja,Mattias Göransson,Janne JuvonenGK,Jonas Ahnelöv,Lukas Kilström,Niclas Andersén,Emil Forslund,Samuel ErssonGK,Daniel Mannberg,NA
441999,2019-12-30,Brynäs IF,IF Malmö Redhawks,Fredrik Händemark,Lars Bryggman,Matias Myttynen,5v4,PP,IF Malmö Redhawks,30,Brynäs IF,29,Johan OlofssonLars BryggmanMatias MyttynenJesper Jensen AaboFredrik HändemarkOscar AlsenfeltGK,Marcus ErssonJosef IngmanJohan AlcénJoacim ErikssonGKDaniel MannbergNA,5,4,Johan Olofsson,Lars Bryggman,Matias Myttynen,Jesper Jensen Aabo,Fredrik Händemark,Oscar AlsenfeltGK,Marcus Ersson,Josef Ingman,Johan Alcén,Joacim ErikssonGK,Daniel Mannberg,NA
441999,2019-12-30,Brynäs IF,IF Malmö Redhawks,Helge Grans,Frederik Storm,Jesper Jensen,5v4,PP,IF Malmö Redhawks,30,Brynäs IF,29,Helge GransFrederik StormCarl-Johan LerbyJesper JensenKonstantin KomarekOscar AlsenfeltGK,Niclas AndersénJosef IngmanEmil ForslundJoacim ErikssonGKJoachim RohdinNA,5,4,Helge Grans,Frederik Storm,Carl-Johan Lerby,Jesper Jensen,Konstantin Komarek,Oscar AlsenfeltGK,Niclas Andersén,Josef Ingman,Emil Forslund,Joacim ErikssonGK,Joachim Rohdin,NA
442012,2020-01-04,Växjö Lakers HC,Brynäs IF,Casey Bailey,,,5v4,PP,Växjö Lakers HC,30,Brynäs IF,30,Emil PetterssonCasey BaileyBrendan ShinniminMartin LundbergViktor FasthGKMiika Koivisto,Lukas KilströmNiclas AndersénSamuel ErssonGKJacob BlomqvistDaniel MannbergNA,5,4,Emil Pettersson,Casey Bailey,Brendan Shinnimin,Martin Lundberg,Viktor FasthGK,Miika Koivisto,Lukas Kilström,Niclas Andersén,Samuel ErssonGK,Jacob Blomqvist,Daniel Mannberg,NA
442085,2020-01-09,Brynäs IF,Rögle BK,Leon Bristedt,Kodie Curran,Daniel Zaar,5v4,PP,Rögle BK,31,Brynäs IF,31,Kodie CurranDennis EverbergRoman WillGKLeon BristedtDaniel ZaarTed Brithén,Lukas KilströmSamuel ErssonGKTomi SallinenJonathan SigaletJoachim RohdinNA,5,4,Kodie Curran,Dennis Everberg,Roman WillGK,Leon Bristedt,Daniel Zaar,Ted Brithén,Lukas Kilström,Samuel ErssonGK,Tomi Sallinen,Jonathan Sigalet,Joachim Rohdin,NA
442094,2020-01-11,Linköping HC,Brynäs IF,Patrik Lundh,Andrew Gordon,Adam Helewka,5v4,PP,Linköping HC,32,Brynäs IF,32,Jonas HolösAndrew GordonAdam HelewkaJonas GustavssonGKJarno KärkiPatrik Lundh,Marcus ErssonSamuel ErssonGKEric NorinTomi SallinenJoachim RohdinNA,5,4,Jonas Holös,Andrew Gordon,Adam Helewka,Jonas GustavssonGK,Jarno Kärki,Patrik Lundh,Marcus Ersson,Samuel ErssonGK,Eric Norin,Tomi Sallinen,Joachim Rohdin,NA
442094,2020-01-11,Linköping HC,Brynäs IF,Broc Little,Henrik Törnqvist,,5v4,PP,Linköping HC,32,Brynäs IF,32,Samuel LofquistHenrik TörnqvistJoe WhitneyJaakko RissanenBroc LittleJonas GustavssonGK,Lukas KilströmMarcus ErssonSamuel ErssonGKLinus ÖlundJoachim RohdinNA,5,4,Samuel Lofquist,Henrik Törnqvist,Joe Whitney,Jaakko Rissanen,Broc Little,Jonas GustavssonGK,Lukas Kilström,Marcus Ersson,Samuel ErssonGK,Linus Ölund,Joachim Rohdin,NA
441803,2019-09-14,Djurgårdens IF,Linköping HC,Jaakko Rissanen,Broc Little,Patrik Lundh,5v4,PP,Linköping HC,1,Djurgårdens IF,1,Joe WhitneyJaakko RissanenBroc LittleSimon LundmarkJonas GustavssonGKPatrik Lundh,Marcus HögströmTom WandellHenrik ErikssonRobin NorellNiklas SvedbergGKNA,5,4,Joe Whitney,Jaakko Rissanen,Broc Little,Simon Lundmark,Jonas GustavssonGK,Patrik Lundh,Marcus Högström,Tom Wandell,Henrik Eriksson,Robin Norell,Niklas SvedbergGK,NA
441818,2019-09-19,Djurgårdens IF,Örebro HK,Ryan Stoa,Shane Harper,Kristian Näkyvä,5v4,PP,Örebro HK,3,Djurgårdens IF,3,Shane HarperAaron IrvingDominik FurchGKKristian NäkyväJoonas RaskRyan Stoa,Tom WandellHenrik ErikssonRobin JensenGKJesper PetterssonRobin NorellNA,5,4,Shane Harper,Aaron Irving,Dominik FurchGK,Kristian Näkyvä,Joonas Rask,Ryan Stoa,Tom Wandell,Henrik Eriksson,Robin JensenGK,Jesper Pettersson,Robin Norell,NA
441828,2019-09-21,IK Oskarshamn,Djurgårdens IF,Tyler Kelleher,Nichlas Hardt,Arsi Piispanen,5v4,PP,IK Oskarshamn,4,Djurgårdens IF,4,Pontus NäsénArsi PiispanenTyler KelleherNichlas HardtTex WilliamssonGKFilip Sveningsson,Patrik BerglundRobin JensenGKJesper PetterssonJacob JosefsonRobin NorellNA,5,4,Pontus Näsén,Arsi Piispanen,Tyler Kelleher,Nichlas Hardt,Tex WilliamssonGK,Filip Sveningsson,Patrik Berglund,Robin JensenGK,Jesper Pettersson,Jacob Josefson,Robin Norell,NA
441838,2019-10-01,Brynäs IF,Djurgårdens IF,Adam Brodecki,Josef Ingman,Linus Ölund,5v4,PP,Brynäs IF,5,Djurgårdens IF,6,Josef IngmanAdam BrodeckiJoacim ErikssonGKLinus ÖlundJacob BlomqvistJaedon Descheneau,Patrik BerglundErik Walli WalterholmOlle AlsingTom NilssonNiklas SvedbergGKNA,5,4,Josef Ingman,Adam Brodecki,Joacim ErikssonGK,Linus Ölund,Jacob Blomqvist,Jaedon Descheneau,Patrik Berglund,Erik Walli Walterholm,Olle Alsing,Tom Nilsson,Niklas SvedbergGK,NA
441845,2019-10-03,Djurgårdens IF,Färjestad BK,Michael Lindqvist,Johan Ryno,Jonathon Blum,5v4,PP,Färjestad BK,7,Djurgårdens IF,7,Marcus NilssonPer ÅslundJonathon BlumMichael LindqvistJohan RynoArvid HolmGK,Marcus HögströmTom WandellHenrik ErikssonOlle AlsingNiklas SvedbergGKNA,5,4,Marcus Nilsson,Per Åslund,Jonathon Blum,Michael Lindqvist,Johan Ryno,Arvid HolmGK,Marcus Högström,Tom Wandell,Henrik Eriksson,Olle Alsing,Niklas SvedbergGK,NA
441845,2019-10-03,Djurgårdens IF,Färjestad BK,Jonathon Blum,Marcus Nilsson,Michael Lindqvist,5v3,PP,Färjestad BK,7,Djurgårdens IF,7,Marcus NilssonPer ÅslundJonathon BlumMichael LindqvistJohan RynoArvid HolmGK,Sebastian StrandbergJesper PetterssonTom NilssonNiklas SvedbergGKNANA,5,3,Marcus Nilsson,Per Åslund,Jonathon Blum,Michael Lindqvist,Johan Ryno,Arvid HolmGK,Sebastian Strandberg,Jesper Pettersson,Tom Nilsson,Niklas SvedbergGK,NA,NA
441845,2019-10-03,Djurgårdens IF,Färjestad BK,Lukas Ekeståhl-Jonsson,,,1v0,SO,Färjestad BK,7,Djurgårdens IF,7,Lukas Ekeståhl-JonssonNANANANANA,Niklas SvedbergGKNANANANANA,1,0,Lukas Ekeståhl-Jonsson,NA,NA,NA,NA,NA,Niklas SvedbergGK,NA,NA,NA,NA,NA
441865,2019-10-10,Rögle BK,Djurgårdens IF,Daniel Zaar,Kodie Curran,,3v3,EV,Rögle BK,9,Djurgårdens IF,9,Kodie CurranDennis EverbergChristoffer RifalkGKDaniel ZaarNANA,Patrik BerglundSebastian StrandbergKarri RämöGKOlle AlsingNANA,3,3,Kodie Curran,Dennis Everberg,Christoffer RifalkGK,Daniel Zaar,NA,NA,Patrik Berglund,Sebastian Strandberg,Karri RämöGK,Olle Alsing,NA,NA
441888,2019-10-24,Djurgårdens IF,Frölunda HC,Jacob Moverare,Rhett Rakhshani,,3v3,EV,Frölunda HC,13,Djurgårdens IF,13,Jacob MoverareNicklas LasuNiklas RubinGKRhett RakhshaniNANA,Karri RämöGKOlle AlsingMattias GuterMichael HagaNANA,3,3,Jacob Moverare,Nicklas Lasu,Niklas RubinGK,Rhett Rakhshani,NA,NA,Karri RämöGK,Olle Alsing,Mattias Guter,Michael Haga,NA,NA
441888,2019-10-24,Djurgårdens IF,Frölunda HC,Johan Sundström,Patrik Carlsson,Ryan Lasch,5v4,PP,Frölunda HC,13,Djurgårdens IF,13,Karl StolleryJohan SundströmNicklas LasuNiklas RubinGKPatrik CarlssonRyan Lasch,Marcus HögströmHenrik ErikssonErik Walli WalterholmKarri RämöGKTom NilssonNA,5,4,Karl Stollery,Johan Sundström,Nicklas Lasu,Niklas RubinGK,Patrik Carlsson,Ryan Lasch,Marcus Högström,Henrik Eriksson,Erik Walli Walterholm,Karri RämöGK,Tom Nilsson,NA
441965,2019-10-29,Djurgårdens IF,Rögle BK,Daniel Zaar,Leon Bristedt,Anton Bengtsson,5v4,PP,Rögle BK,15,Djurgårdens IF,15,Dennis EverbergAnton BengtssonRoman WillGKLeon BristedtDaniel ZaarEric Gelinas,Erik Walli WalterholmJesper PetterssonRobin NorellManuel ÅgrenNiklas SvedbergGKNA,5,4,Dennis Everberg,Anton Bengtsson,Roman WillGK,Leon Bristedt,Daniel Zaar,Eric Gelinas,Erik Walli Walterholm,Jesper Pettersson,Robin Norell,Manuel Ågren,Niklas SvedbergGK,NA
441906,2019-10-31,Skellefteå AIK,Djurgårdens IF,Jesper Frödén,Jonatan Berggren,Jacob Olofsson,5v4,PP,Skellefteå AIK,15,Djurgårdens IF,16,Filip BerglundRobin AlvarezJesper FrödénJacob OlofssonJonatan BerggrenMantas ArmalisGK,Henrik ErikssonSebastian StrandbergKarri RämöGKOlle AlsingTom NilssonNA,5,4,Filip Berglund,Robin Alvarez,Jesper Frödén,Jacob Olofsson,Jonatan Berggren,Mantas ArmalisGK,Henrik Eriksson,Sebastian Strandberg,Karri RämöGK,Olle Alsing,Tom Nilsson,NA
441906,2019-10-31,Skellefteå AIK,Djurgårdens IF,Jesper Frödén,Jacob Olofsson,Jonatan Berggren,5v4,PP,Skellefteå AIK,15,Djurgårdens IF,16,Filip BerglundRobin AlvarezJesper FrödénJacob OlofssonJonatan BerggrenMantas ArmalisGK,Kalle ÖstmanLudvig HedströmPatrik BerglundKarri RämöGKLinus HultströmNA,5,4,Filip Berglund,Robin Alvarez,Jesper Frödén,Jacob Olofsson,Jonatan Berggren,Mantas ArmalisGK,Kalle Östman,Ludvig Hedström,Patrik Berglund,Karri RämöGK,Linus Hultström,NA
441909,2019-11-02,Färjestad BK,Djurgårdens IF,Per Åslund,Jonathon Blum,Marcus Nilsson,5v4,PP,Färjestad BK,16,Djurgårdens IF,17,Marcus NilssonPer ÅslundJonathon BlumMichael LindqvistMarkus SvenssonGKJohan Ryno,Patrik BerglundSebastian StrandbergOlle AlsingTom NilssonNiklas SvedbergGKNA,5,4,Marcus Nilsson,Per Åslund,Jonathon Blum,Michael Lindqvist,Markus SvenssonGK,Johan Ryno,Patrik Berglund,Sebastian Strandberg,Olle Alsing,Tom Nilsson,Niklas SvedbergGK,NA
441909,2019-11-02,Färjestad BK,Djurgårdens IF,Michael Lindqvist,Marcus Nilsson,Johan Ryno,5v4,PP,Färjestad BK,16,Djurgårdens IF,17,Marcus NilssonPer ÅslundJonathon BlumMichael LindqvistMarkus SvenssonGKJohan Ryno,Henrik ErikssonSebastian StrandbergLinus HultströmRobin NorellNiklas SvedbergGKNA,5,4,Marcus Nilsson,Per Åslund,Jonathon Blum,Michael Lindqvist,Markus SvenssonGK,Johan Ryno,Henrik Eriksson,Sebastian Strandberg,Linus Hultström,Robin Norell,Niklas SvedbergGK,NA
441923,2019-11-16,Linköping HC,Djurgårdens IF,Jonas Holös,Adam Helewka,Jarno Kärki,5v4,PP,Linköping HC,18,Djurgårdens IF,19,Jonas HolösHenrik TörnqvistOlle LycksellAdam HelewkaJonas GustavssonGKJarno Kärki,Tom WandellHenrik ErikssonKarri RämöGKJesper PetterssonRobin NorellNA,5,4,Jonas Holös,Henrik Törnqvist,Olle Lycksell,Adam Helewka,Jonas GustavssonGK,Jarno Kärki,Tom Wandell,Henrik Eriksson,Karri RämöGK,Jesper Pettersson,Robin Norell,NA
441923,2019-11-16,Linköping HC,Djurgårdens IF,Joe Whitney,Broc Little,Andrew Gordon,5v4,PP,Linköping HC,18,Djurgårdens IF,19,Samuel LofquistAndrew GordonJoe WhitneyBroc LittleJonas GustavssonGKPatrik Lundh,Jason GarrisonTom WandellHenrik ErikssonKarri RämöGKTom NilssonNA,5,4,Samuel Lofquist,Andrew Gordon,Joe Whitney,Broc Little,Jonas GustavssonGK,Patrik Lundh,Jason Garrison,Tom Wandell,Henrik Eriksson,Karri RämöGK,Tom Nilsson,NA
441923,2019-11-16,Linköping HC,Djurgårdens IF,Jarno Kärki,Adam Helewka,Olle Lycksell,5v4,PP,Linköping HC,18,Djurgårdens IF,19,Jonas HolösHenrik TörnqvistOlle LycksellAdam HelewkaJonas GustavssonGKJarno Kärki,Jason GarrisonTom WandellHenrik ErikssonTom NilssonNiklas SvedbergGKNA,5,4,Jonas Holös,Henrik Törnqvist,Olle Lycksell,Adam Helewka,Jonas GustavssonGK,Jarno Kärki,Jason Garrison,Tom Wandell,Henrik Eriksson,Tom Nilsson,Niklas SvedbergGK,NA
441931,2019-11-21,HV 71,Djurgårdens IF,Eric Martinsson,Anthony Camara,Axel Holmström,5v4,PP,HV 71,19,Djurgårdens IF,20,Axel HolmströmAlexander BergströmJohannes KinnvallAnthony CamaraJonas GunnarssonGKEric Martinsson,Tom WandellHenrik ErikssonJesper PetterssonRobin NorellNiklas SvedbergGKNA,5,4,Axel Holmström,Alexander Bergström,Johannes Kinnvall,Anthony Camara,Jonas GunnarssonGK,Eric Martinsson,Tom Wandell,Henrik Eriksson,Jesper Pettersson,Robin Norell,Niklas SvedbergGK,NA
441931,2019-11-21,HV 71,Djurgårdens IF,Emil Johansson,Anthony Camara,Jonas Gunnarsson,3v3,EV,HV 71,19,Djurgårdens IF,20,Simon ÖnerudEmil JohanssonAnthony CamaraJonas GunnarssonGKNANA,Marcus HögströmMattias GuterMichael HagaNiklas SvedbergGKNANA,3,3,Simon Önerud,Emil Johansson,Anthony Camara,Jonas GunnarssonGK,NA,NA,Marcus Högström,Mattias Guter,Michael Haga,Niklas SvedbergGK,NA,NA
441936,2019-11-23,Djurgårdens IF,Växjö Lakers HC,Ilari Melart,Tim Erixon,Marcus Davidsson,5v4,PP,Växjö Lakers HC,20,Djurgårdens IF,21,Tim ErixonMarcus DavidssonIlari MelartMartin LundbergErik KällgrenGKFredrik Karlström,Patrik BerglundDick AxelssonKarri RämöGKJesper PetterssonRobin NorellNA,5,4,Tim Erixon,Marcus Davidsson,Ilari Melart,Martin Lundberg,Erik KällgrenGK,Fredrik Karlström,Patrik Berglund,Dick Axelsson,Karri RämöGK,Jesper Pettersson,Robin Norell,NA
441957,2019-12-05,Frölunda HC,Djurgårdens IF,Ryan Lasch,Max Friberg,Theodor Lennström,5v4,PP,Frölunda HC,23,Djurgårdens IF,24,Max FribergNicklas LasuJohan MattssonGKTheodor LennströmPatrik CarlssonRyan Lasch,Kalle ÖstmanJesper PetterssonRobin NorellGustav PosslerNiklas SvedbergGKNA,5,4,Max Friberg,Nicklas Lasu,Johan MattssonGK,Theodor Lennström,Patrik Carlsson,Ryan Lasch,Kalle Östman,Jesper Pettersson,Robin Norell,Gustav Possler,Niklas SvedbergGK,NA
441981,2019-12-19,IF Malmö Redhawks,Djurgårdens IF,Matias Myttynen,Tobias Ekberg,Marcus Björk,5v4,PP,IF Malmö Redhawks,26,Djurgårdens IF,26,Marcus BjörkFrederik StormMatias MyttynenTobias EkbergEmil SylvegårdOscar AlsenfeltGK,Marcus HögströmSebastian StrandbergKarri RämöGKJesper PetterssonOlle AlsingNA,5,4,Marcus Björk,Frederik Storm,Matias Myttynen,Tobias Ekberg,Emil Sylvegård,Oscar AlsenfeltGK,Marcus Högström,Sebastian Strandberg,Karri RämöGK,Jesper Pettersson,Olle Alsing,NA
441991,2019-12-26,Växjö Lakers HC,Djurgårdens IF,Roman Horak,Jakob Forsbacka-Karlsson,Richard Gynge,5v4,PP,Växjö Lakers HC,27,Djurgårdens IF,27,Marcus DavidssonRichard GyngeIlari MelartJakob Forsbacka-KarlssonRoman HorakViktor AndrénGK,Marcus HögströmTom WandellKarri RämöGKJesper PetterssonManuel ÅgrenNA,5,4,Marcus Davidsson,Richard Gynge,Ilari Melart,Jakob Forsbacka-Karlsson,Roman Horak,Viktor AndrénGK,Marcus Högström,Tom Wandell,Karri RämöGK,Jesper Pettersson,Manuel Ågren,NA
