gameid,date,home_team,away_team,goal,primary_assist,secondary_assist,game_situation,game_situation_general,gf_team,gf_team_game_number,ga_team,ga_team_game_number,GF_names,GA_names,GF_skaters,GA_skaters,GF1_name,GF2_name,GF3_name,GF4_name,GF5_name,GF6_name,GA1_name,GA2_name,GA3_name,GA4_name,GA5_name,GA6_name
441916,2019-11-14,Färjestad BK,Brynäs IF,Martin Johansson,Jesper Olofsson,Johan Ryno,5v5,EV,Färjestad BK,17,Brynäs IF,17,Martin JohanssonLinus ArnessonSebastian ErixonJohan RynoArvid HolmGKJesper Olofsson,Lukas KilströmEmil MolinJoacim ErikssonGKEric NorinTomi SallinenDaniel Mannberg,5,5,Martin Johansson,Linus Arnesson,Sebastian Erixon,Johan Ryno,Arvid HolmGK,Jesper Olofsson,Lukas Kilström,Emil Molin,Joacim ErikssonGK,Eric Norin,Tomi Sallinen,Daniel Mannberg
441951,2019-11-30,HV 71,Brynäs IF,Martin Thörnberg,Eric Martinsson,Nils Andersson,5v5,EV,HV 71,22,Brynäs IF,22,Nils AnderssonMartin ThörnbergSimon ÖnerudHugo AlnefeltGKEric MartinssonLinus Fröberg,Lukas KilströmMarcus ErssonJohan AlcénSamuel ErssonGKJacob BlomqvistDaniel Mannberg,5,5,Nils Andersson,Martin Thörnberg,Simon Önerud,Hugo AlnefeltGK,Eric Martinsson,Linus Fröberg,Lukas Kilström,Marcus Ersson,Johan Alcén,Samuel ErssonGK,Jacob Blomqvist,Daniel Mannberg
441998,2019-12-28,Leksands IF,Brynäs IF,Lucas Nordsäter,Oskar Lang,,5v5,EV,Leksands IF,28,Brynäs IF,28,Lucas NordsäterOskar LangSebastian WännströmMarek HrivikJanne JuvonenGKPhilip Samuelsson,Niclas LundgrenNiclas AndersénEmil MolinSamuel ErssonGKLinus ÖlundDaniel Mannberg,5,5,Lucas Nordsäter,Oskar Lang,Sebastian Wännström,Marek Hrivik,Janne JuvonenGK,Philip Samuelsson,Niclas Lundgren,Niclas Andersén,Emil Molin,Samuel ErssonGK,Linus Ölund,Daniel Mannberg
441999,2019-12-30,Brynäs IF,IF Malmö Redhawks,Carl Persson,Konstantin Komarek,Axel Wemmenborn,5v5,EV,IF Malmö Redhawks,30,Brynäs IF,29,Helge GransCarl-Johan LerbyAxel WemmenbornKonstantin KomarekOscar AlsenfeltGKCarl Persson,Lukas KilströmJoacim ErikssonGKLinus ÖlundJonathan SigaletJoachim RohdinDaniel Mannberg,5,5,Helge Grans,Carl-Johan Lerby,Axel Wemmenborn,Konstantin Komarek,Oscar AlsenfeltGK,Carl Persson,Lukas Kilström,Joacim ErikssonGK,Linus Ölund,Jonathan Sigalet,Joachim Rohdin,Daniel Mannberg
442012,2020-01-04,Växjö Lakers HC,Brynäs IF,Brendan Shinnimin,Marcus Davidsson,,5v5,EV,Växjö Lakers HC,30,Brynäs IF,30,Marcus DavidssonIlari MelartRoman HorakBrendan ShinniminViktor FasthGKMiika Koivisto,Niclas AndersénMarcus ErssonAdam BrodeckiSamuel ErssonGKJacob BlomqvistDaniel Mannberg,5,5,Marcus Davidsson,Ilari Melart,Roman Horak,Brendan Shinnimin,Viktor FasthGK,Miika Koivisto,Niclas Andersén,Marcus Ersson,Adam Brodecki,Samuel ErssonGK,Jacob Blomqvist,Daniel Mannberg
442085,2020-01-09,Brynäs IF,Rögle BK,Dominik Bokk,Nils Höglander,Samuel Johannesson,5v5,EV,Rögle BK,31,Brynäs IF,31,Daniel BertovErlend LesundSimon RyforsNils HöglanderRoman WillGKDominik Bokk,Niclas AndersénMarcus ErssonEmil MolinSamuel ErssonGKGreg ScottDaniel Mannberg,5,5,Daniel Bertov,Erlend Lesund,Simon Ryfors,Nils Höglander,Roman WillGK,Dominik Bokk,Niclas Andersén,Marcus Ersson,Emil Molin,Samuel ErssonGK,Greg Scott,Daniel Mannberg
442099,2020-01-16,Brynäs IF,Färjestad BK,Gustav Rydahl,Jonathon Blum,,5v5,EV,Färjestad BK,32,Brynäs IF,33,Jens WestinDaniel VikstenGustav RydahlJonathon BlumMarkus SvenssonGKLinus Johansson,Victor SöderströmEmil MolinSamuel ErssonGKLinus ÖlundJonathan SigaletDaniel Mannberg,5,5,Jens Westin,Daniel Viksten,Gustav Rydahl,Jonathon Blum,Markus SvenssonGK,Linus Johansson,Victor Söderström,Emil Molin,Samuel ErssonGK,Linus Ölund,Jonathan Sigalet,Daniel Mannberg
442112,2020-01-18,Skellefteå AIK,Brynäs IF,Niclas Burström,Jonathan Pudas,Rickard Hugg,6v5,Goalie Pulled,Skellefteå AIK,34,Brynäs IF,34,Niclas BurströmTom PyattAdam PetterssonLinus LindströmJonathan PudasRickard Hugg,Josef IngmanEmil MolinJoacim ErikssonGKTomi SallinenJonathan SigaletDaniel Mannberg,6,5,Niclas Burström,Tom Pyatt,Adam Pettersson,Linus Lindström,Jonathan Pudas,Rickard Hugg,Josef Ingman,Emil Molin,Joacim ErikssonGK,Tomi Sallinen,Jonathan Sigalet,Daniel Mannberg
441820,2019-09-19,Frölunda HC,Linköping HC,Jacob Peterson,Ryan Lasch,Simon Hjalmarsson,5v5,EV,Frölunda HC,3,Linköping HC,3,Jacob MoverareViktor EkbomJohan MattssonGKJacob PetersonSimon HjalmarssonRyan Lasch,Jonas HolösJaakko RissanenJacob JohanssonGKBroc LittleMax LindrothPatrik Lundh,5,5,Jacob Moverare,Viktor Ekbom,Johan MattssonGK,Jacob Peterson,Simon Hjalmarsson,Ryan Lasch,Jonas Holös,Jaakko Rissanen,Jacob JohanssonGK,Broc Little,Max Lindroth,Patrik Lundh
441833,2019-09-26,Luleå HF,Linköping HC,Fredrik Styrman,,,5v5,EV,Luleå HF,5,Linköping HC,5,Fredrik StyrmanPetter EmanuelssonJack ConnollyJoel LassinanttiGKPontus SjälinAustin Farley,Joe WhitneyJaakko RissanenJacob JohanssonGKEddie LarssonMax LindrothPatrik Lundh,5,5,Fredrik Styrman,Petter Emanuelsson,Jack Connolly,Joel LassinanttiGK,Pontus Själin,Austin Farley,Joe Whitney,Jaakko Rissanen,Jacob JohanssonGK,Eddie Larsson,Max Lindroth,Patrik Lundh
441861,2019-10-01,HV 71,Linköping HC,Joakim Andersson,Christoffer Törngren,,5v5,EV,HV 71,7,Linköping HC,7,Joakim AnderssonJohannes KinnvallJonas GunnarssonGKJuuso IkonenEric MartinssonChristoffer Törngren,Andrew GordonJaakko RissanenJonas GustavssonGKMax LindrothAnton MylläriPatrik Lundh,5,5,Joakim Andersson,Johannes Kinnvall,Jonas GunnarssonGK,Juuso Ikonen,Eric Martinsson,Christoffer Törngren,Andrew Gordon,Jaakko Rissanen,Jonas GustavssonGK,Max Lindroth,Anton Mylläri,Patrik Lundh
441861,2019-10-01,HV 71,Linköping HC,Juuso Ikonen,Christoffer Törngren,Nils Andersson,5v5,EV,HV 71,7,Linköping HC,7,Markus LauridsenNils AnderssonJoakim AnderssonJonas GunnarssonGKJuuso IkonenChristoffer Törngren,Andrew GordonJaakko RissanenSimon LundmarkJonas GustavssonGKEddie LarssonPatrik Lundh,5,5,Markus Lauridsen,Nils Andersson,Joakim Andersson,Jonas GunnarssonGK,Juuso Ikonen,Christoffer Törngren,Andrew Gordon,Jaakko Rissanen,Simon Lundmark,Jonas GustavssonGK,Eddie Larsson,Patrik Lundh
441876,2019-10-17,Linköping HC,Örebro HK,Sakari Salminen,,,5v6ENG,ENG,Örebro HK,11,Linköping HC,11,Rasmus RissanenSakari SalminenJonas ArntzenGKKristian NäkyväMathias BroméRyan Stoa,Jonas HolösBroc LittleEddie LarssonRobin JohanssonAnton MylläriPatrik Lundh,5,6,Rasmus Rissanen,Sakari Salminen,Jonas ArntzenGK,Kristian Näkyvä,Mathias Bromé,Ryan Stoa,Jonas Holös,Broc Little,Eddie Larsson,Robin Johansson,Anton Mylläri,Patrik Lundh
441876,2019-10-17,Linköping HC,Örebro HK,Kristian Näkyvä,Marcus Weinstock,Christopher Mastomäki,5v5,EV,Örebro HK,11,Linköping HC,11,Rasmus RissanenMarcus WeinstockJonas ArntzenGKChristopher MastomäkiGlenn GustafssonKristian Näkyvä,Jonas HolösAdam HelewkaBroc LittleJonas GustavssonGKMax LindrothPatrik Lundh,5,5,Rasmus Rissanen,Marcus Weinstock,Jonas ArntzenGK,Christopher Mastomäki,Glenn Gustafsson,Kristian Näkyvä,Jonas Holös,Adam Helewka,Broc Little,Jonas GustavssonGK,Max Lindroth,Patrik Lundh
441882,2019-10-19,IK Oskarshamn,Linköping HC,Pontus Netterberg,Henrik Nilsson,,5v5,EV,IK Oskarshamn,12,Linköping HC,12,Pontus NetterbergJohn DahlströmHenrik NilssonFiliph EngsundEmil WahlbergTex WilliamssonGK,Adam GinningAdam HelewkaBroc LittleJonas GustavssonGKEddie LarssonPatrik Lundh,5,5,Pontus Netterberg,John Dahlström,Henrik Nilsson,Filiph Engsund,Emil Wahlberg,Tex WilliamssonGK,Adam Ginning,Adam Helewka,Broc Little,Jonas GustavssonGK,Eddie Larsson,Patrik Lundh
441882,2019-10-19,IK Oskarshamn,Linköping HC,Simon Despres,Pontus Netterberg,,5v5,EV,IK Oskarshamn,12,Linköping HC,12,Jesper DahlrothSimon DespresPontus NetterbergArsi PiispanenChristian LindbergTex WilliamssonGK,William Worge KreüJonas HolösAdam HelewkaBroc LittleJonas GustavssonGKPatrik Lundh,5,5,Jesper Dahlroth,Simon Despres,Pontus Netterberg,Arsi Piispanen,Christian Lindberg,Tex WilliamssonGK,William Worge Kreü,Jonas Holös,Adam Helewka,Broc Little,Jonas GustavssonGK,Patrik Lundh
441938,2019-11-23,Linköping HC,Frölunda HC,Max Friberg,,,5v6ENG,ENG,Frölunda HC,20,Linköping HC,20,Max FribergSebastian StålbergTheodor LennströmJoel MustonenNiklas RubinGKDavid Printz,Samuel LofquistAndrew GordonHampus LarssonJaakko RissanenBroc LittlePatrik Lundh,5,6,Max Friberg,Sebastian Stålberg,Theodor Lennström,Joel Mustonen,Niklas RubinGK,David Printz,Samuel Lofquist,Andrew Gordon,Hampus Larsson,Jaakko Rissanen,Broc Little,Patrik Lundh
441952,2019-11-30,Linköping HC,Luleå HF,Nils Lundkvist,Erik Gustafsson,Jack Connolly,5v5,EV,Luleå HF,22,Linköping HC,22,Petter EmanuelssonJack ConnollyNils LundkvistErik GustafssonDavid RautioGKAustin Farley,Jonas HolösJoe WhitneyJacob JohanssonGKRobin JohanssonAnton MylläriPatrik Lundh,5,5,Petter Emanuelsson,Jack Connolly,Nils Lundkvist,Erik Gustafsson,David RautioGK,Austin Farley,Jonas Holös,Joe Whitney,Jacob JohanssonGK,Robin Johansson,Anton Mylläri,Patrik Lundh
441952,2019-11-30,Linköping HC,Luleå HF,Isac Brännström,Jonas Berglund,Noel Gunler,5v5,EV,Luleå HF,22,Linköping HC,22,Noel GunlerJonas BerglundIsac BrännströmErik GustafssonDavid RautioGKOscar Engsund,Jonas HolösJoe WhitneyJacob JohanssonGKAdam HelewkaAnton MylläriPatrik Lundh,5,5,Noel Gunler,Jonas Berglund,Isac Brännström,Erik Gustafsson,David RautioGK,Oscar Engsund,Jonas Holös,Joe Whitney,Jacob JohanssonGK,Adam Helewka,Anton Mylläri,Patrik Lundh
441981,2019-12-19,IF Malmö Redhawks,Djurgårdens IF,Matias Myttynen,Fredrik Händemark,Johan Olofsson,5v5,EV,IF Malmö Redhawks,26,Djurgårdens IF,26,Johan OlofssonMatias LassenMatias MyttynenJesper Jensen AaboFredrik HändemarkOscar AlsenfeltGK,Kalle ÖstmanHenrik ErikssonSimon JohanssonKarri RämöGKLinus HultströmGustav Possler,5,5,Johan Olofsson,Matias Lassen,Matias Myttynen,Jesper Jensen Aabo,Fredrik Händemark,Oscar AlsenfeltGK,Kalle Östman,Henrik Eriksson,Simon Johansson,Karri RämöGK,Linus Hultström,Gustav Possler
441805,2019-09-14,Frölunda HC,Brynäs IF,Jacob Blomqvist,Daniel Mannberg,Joachim Rohdin,5v5,EV,Brynäs IF,1,Frölunda HC,1,Lukas KilströmJoacim ErikssonGKJacob BlomqvistEric NorinJoachim RohdinDaniel Mannberg,Anders GrönlundJohan MattssonGKSimon HjalmarssonJulius BergmanPatrik CarlssonRyan Lasch,5,5,Lukas Kilström,Joacim ErikssonGK,Jacob Blomqvist,Eric Norin,Joachim Rohdin,Daniel Mannberg,Anders Grönlund,Johan MattssonGK,Simon Hjalmarsson,Julius Bergman,Patrik Carlsson,Ryan Lasch
441829,2019-09-21,Örebro HK,Frölunda HC,Shane Harper,Daniel Muzito-Bagenda,Jonathan Andersson,5v5,EV,Örebro HK,4,Frölunda HC,4,Rasmus RissanenShane HarperDaniel Muzito-BagendaJonathan AnderssonDominik FurchGKJoonas Rask,Jacob MoverareViktor EkbomJohan MattssonGKJacob PetersonSimon HjalmarssonRyan Lasch,5,5,Rasmus Rissanen,Shane Harper,Daniel Muzito-Bagenda,Jonathan Andersson,Dominik FurchGK,Joonas Rask,Jacob Moverare,Viktor Ekbom,Johan MattssonGK,Jacob Peterson,Simon Hjalmarsson,Ryan Lasch
441829,2019-09-21,Örebro HK,Frölunda HC,Shane Harper,Gustav Backström,Joonas Rask,5v5,EV,Örebro HK,4,Frölunda HC,4,Gustav BackströmShane HarperDaniel Muzito-BagendaAaron IrvingDominik FurchGKJoonas Rask,Karl StolleryJohan SundströmJohan MattssonGKSimon HjalmarssonJulius BergmanRyan Lasch,5,5,Gustav Backström,Shane Harper,Daniel Muzito-Bagenda,Aaron Irving,Dominik FurchGK,Joonas Rask,Karl Stollery,Johan Sundström,Johan MattssonGK,Simon Hjalmarsson,Julius Bergman,Ryan Lasch
441829,2019-09-21,Örebro HK,Frölunda HC,Christopher Mastomäki,Marcus Weinstock,Kristian Näkyvä,5v5,EV,Örebro HK,4,Frölunda HC,4,Rasmus RissanenMarcus WeinstockChristopher MastomäkiGlenn GustafssonDominik FurchGKKristian Näkyvä,Jacob MoverareViktor EkbomJohan MattssonGKJacob PetersonSimon HjalmarssonRyan Lasch,5,5,Rasmus Rissanen,Marcus Weinstock,Christopher Mastomäki,Glenn Gustafsson,Dominik FurchGK,Kristian Näkyvä,Jacob Moverare,Viktor Ekbom,Johan MattssonGK,Jacob Peterson,Simon Hjalmarsson,Ryan Lasch
442198,2019-10-12,Frölunda HC,Luleå HF,Einar Emanuelsson,Jack Connolly,,5v5,EV,Luleå HF,10,Frölunda HC,10,Einar EmanuelssonJack ConnollyJesper SellgrenNils LundkvistDavid RautioGKAustin Farley,Samuel FagemoAnders GrönlundJohan SundströmJohan MattssonGKBrandon GormleyRyan Lasch,5,5,Einar Emanuelsson,Jack Connolly,Jesper Sellgren,Nils Lundkvist,David RautioGK,Austin Farley,Samuel Fagemo,Anders Grönlund,Johan Sundström,Johan MattssonGK,Brandon Gormley,Ryan Lasch
441875,2019-10-17,Frölunda HC,Växjö Lakers HC,Roman Horak,Jakob Forsbacka-Karlsson,,5v5,EV,Växjö Lakers HC,11,Frölunda HC,11,Ilari MelartJakob Forsbacka-KarlssonRoman HorakLinus NässénMartin LundbergViktor AndrénGK,Samuel FagemoAnders GrönlundJohan MattssonGKDavid PrintzSimon HjalmarssonRyan Lasch,5,5,Ilari Melart,Jakob Forsbacka-Karlsson,Roman Horak,Linus Nässén,Martin Lundberg,Viktor AndrénGK,Samuel Fagemo,Anders Grönlund,Johan MattssonGK,David Printz,Simon Hjalmarsson,Ryan Lasch
441888,2019-10-24,Djurgårdens IF,Frölunda HC,Linus Hultström,Manuel Ågren,Mattias Guter,5v5,EV,Djurgårdens IF,13,Frölunda HC,13,Marcus HögströmKarri RämöGKLinus HultströmMattias GuterManuel ÅgrenMichael Haga,Viktor EkbomNiklas RubinGKJacob PetersonDavid PrintzSimon HjalmarssonRyan Lasch,5,5,Marcus Högström,Karri RämöGK,Linus Hultström,Mattias Guter,Manuel Ågren,Michael Haga,Viktor Ekbom,Niklas RubinGK,Jacob Peterson,David Printz,Simon Hjalmarsson,Ryan Lasch
441908,2019-11-02,Brynäs IF,Frölunda HC,Emil Molin,Emil Forslund,Tomi Sallinen,5v6ENG,ENG,Brynäs IF,16,Frölunda HC,16,Lukas KilströmEmil MolinEmil ForslundJoacim ErikssonGKEric NorinTomi Sallinen,Johan SundströmTheodor LennströmJacob PetersonRhett RakhshaniSimon HjalmarssonRyan Lasch,5,6,Lukas Kilström,Emil Molin,Emil Forslund,Joacim ErikssonGK,Eric Norin,Tomi Sallinen,Johan Sundström,Theodor Lennström,Jacob Peterson,Rhett Rakhshani,Simon Hjalmarsson,Ryan Lasch
441926,2019-11-16,Rögle BK,Frölunda HC,Samuel Jonsson,Daniel Zaar,,5v5,EV,Rögle BK,19,Frölunda HC,18,Erlend LesundSamuel JonssonAdam EdströmRoman WillGKErik AnderssonDaniel Zaar,Anders GrönlundJohan MattssonGKJacob PetersonSimon HjalmarssonJulius BergmanRyan Lasch,5,5,Erlend Lesund,Samuel Jonsson,Adam Edström,Roman WillGK,Erik Andersson,Daniel Zaar,Anders Grönlund,Johan MattssonGK,Jacob Peterson,Simon Hjalmarsson,Julius Bergman,Ryan Lasch
441930,2019-11-21,Frölunda HC,Leksands IF,Thomas Valkvae-Olsen,Oskar Lang,Jon Knuts,5v5,EV,Leksands IF,19,Frölunda HC,19,Calle SjälinFilip JohanssonJon KnutsOskar LangThomas Valkvae-OlsenJanne JuvonenGK,Anders GrönlundBrandon GormleyNiklas RubinGKJacob PetersonSimon HjalmarssonRyan Lasch,5,5,Calle Själin,Filip Johansson,Jon Knuts,Oskar Lang,Thomas Valkvae-Olsen,Janne JuvonenGK,Anders Grönlund,Brandon Gormley,Niklas RubinGK,Jacob Peterson,Simon Hjalmarsson,Ryan Lasch
441950,2019-11-30,Färjestad BK,Frölunda HC,Vojtech Mozik,Martin Johansson,Gustav Rydahl,5v5,EV,Färjestad BK,22,Frölunda HC,22,Gustav RydahlLukas Ekeståhl-JonssonMartin JohanssonMichael LindqvistVojtech MozikArvid HolmGK,Anders GrönlundBrandon GormleyNiklas RubinGKJacob PetersonSimon HjalmarssonRyan Lasch,5,5,Gustav Rydahl,Lukas Ekeståhl-Jonsson,Martin Johansson,Michael Lindqvist,Vojtech Mozik,Arvid HolmGK,Anders Grönlund,Brandon Gormley,Niklas RubinGK,Jacob Peterson,Simon Hjalmarsson,Ryan Lasch
441950,2019-11-30,Färjestad BK,Frölunda HC,Daniel Viksten,Oskar Bäck,Carl Jakobsson,6v5,Goalie Pulled,Färjestad BK,22,Frölunda HC,22,Johan IvarssonDaniel VikstenOskar BäckLinus ArnessonCarl JakobssonLinus Johansson,Anders GrönlundBrandon GormleyNiklas RubinGKJacob PetersonSimon HjalmarssonRyan Lasch,6,5,Johan Ivarsson,Daniel Viksten,Oskar Bäck,Linus Arnesson,Carl Jakobsson,Linus Johansson,Anders Grönlund,Brandon Gormley,Niklas RubinGK,Jacob Peterson,Simon Hjalmarsson,Ryan Lasch
441966,2019-12-07,Frölunda HC,HV 71,Anthony Camara,Linus Fröberg,Alexander Bergström,5v5,EV,HV 71,24,Frölunda HC,24,Nils AnderssonAlexander BergströmAnthony CamaraJonas GunnarssonGKEric MartinssonLinus Fröberg,Anders GrönlundSebastian StålbergNicklas LasuBrandon GormleyNiklas RubinGKRyan Lasch,5,5,Nils Andersson,Alexander Bergström,Anthony Camara,Jonas GunnarssonGK,Eric Martinsson,Linus Fröberg,Anders Grönlund,Sebastian Stålberg,Nicklas Lasu,Brandon Gormley,Niklas RubinGK,Ryan Lasch
441966,2019-12-07,Frölunda HC,HV 71,Axel Holmström,Alexander Bergström,Johannes Kinnvall,5v5,EV,HV 71,24,Frölunda HC,24,Axel HolmströmAlexander BergströmJohannes KinnvallAnthony CamaraJonas GunnarssonGKEric Martinsson,Theodor LennströmNiklas RubinGKJacob PetersonDavid PrintzSimon HjalmarssonRyan Lasch,5,5,Axel Holmström,Alexander Bergström,Johannes Kinnvall,Anthony Camara,Jonas GunnarssonGK,Eric Martinsson,Theodor Lennström,Niklas RubinGK,Jacob Peterson,David Printz,Simon Hjalmarsson,Ryan Lasch
442090,2020-01-09,Skellefteå AIK,Frölunda HC,Linus Lindström,Jesper Frödén,Filip Berglund,5v6ENG,ENG,Skellefteå AIK,31,Frölunda HC,31,Filip BerglundLinus LindströmPatrik NorénJesper FrödénGustaf LindvallGKOscar Möller,Samuel FagemoJoel LundqvistTheodor LennströmRhett RakhshaniSimon HjalmarssonRyan Lasch,5,6,Filip Berglund,Linus Lindström,Patrik Norén,Jesper Frödén,Gustaf LindvallGK,Oscar Möller,Samuel Fagemo,Joel Lundqvist,Theodor Lennström,Rhett Rakhshani,Simon Hjalmarsson,Ryan Lasch
442096,2020-01-11,Örebro HK,Frölunda HC,Jordan Boucher,Glenn Gustafsson,Christopher Mastomäki,5v5,EV,Örebro HK,32,Frölunda HC,32,Stefan WargJonas ArntzenGKChristopher MastomäkiGlenn GustafssonJordan BoucherAlfred Barklund,Karl StollerySamuel FagemoJoel LundqvistTheodor LennströmNiklas RubinGKRyan Lasch,5,5,Stefan Warg,Jonas ArntzenGK,Christopher Mastomäki,Glenn Gustafsson,Jordan Boucher,Alfred Barklund,Karl Stollery,Samuel Fagemo,Joel Lundqvist,Theodor Lennström,Niklas RubinGK,Ryan Lasch
442096,2020-01-11,Örebro HK,Frölunda HC,Shane Harper,Ryan Stoa,Mathias Bromé,5v5,EV,Örebro HK,32,Frölunda HC,32,Gustav BackströmShane HarperJonas ArntzenGKAlfred BarklundMathias BroméRyan Stoa,Anders GrönlundJohan SundströmNicklas LasuBrandon GormleyNiklas RubinGKRyan Lasch,5,5,Gustav Backström,Shane Harper,Jonas ArntzenGK,Alfred Barklund,Mathias Bromé,Ryan Stoa,Anders Grönlund,Johan Sundström,Nicklas Lasu,Brandon Gormley,Niklas RubinGK,Ryan Lasch
442096,2020-01-11,Örebro HK,Frölunda HC,Mathias Bromé,Joonas Rask,,5v6ENG,ENG,Örebro HK,32,Frölunda HC,32,Gustav BackströmJonathan AnderssonJonas ArntzenGKMathias BroméJoonas RaskRyan Stoa,Samuel FagemoJoel LundqvistBrandon GormleyRhett RakhshaniMats Rosseli OlsenRyan Lasch,5,6,Gustav Backström,Jonathan Andersson,Jonas ArntzenGK,Mathias Bromé,Joonas Rask,Ryan Stoa,Samuel Fagemo,Joel Lundqvist,Brandon Gormley,Rhett Rakhshani,Mats Rosseli Olsen,Ryan Lasch
442102,2020-01-16,IK Oskarshamn,Frölunda HC,Emil Wahlberg,,,5v6ENG,ENG,IK Oskarshamn,33,Frölunda HC,33,Pontus NetterbergJonas EngströmHenrik NilssonFiliph EngsundEmil WahlbergTex WilliamssonGK,Samuel FagemoJoel LundqvistBrandon GormleyRhett RakhshaniSimon HjalmarssonRyan Lasch,5,6,Pontus Netterberg,Jonas Engström,Henrik Nilsson,Filiph Engsund,Emil Wahlberg,Tex WilliamssonGK,Samuel Fagemo,Joel Lundqvist,Brandon Gormley,Rhett Rakhshani,Simon Hjalmarsson,Ryan Lasch
441843,2019-09-28,IK Oskarshamn,Luleå HF,Carl Mattsson,Juhani Tyrväinen,,4v6ENG,ENG,Luleå HF,6,IK Oskarshamn,6,Carl MattssonJuhani TyrväinenJesper SellgrenJoel LassinanttiGKDaniel SondellNA,Simon DespresArsi PiispanenTyler KelleherFiliph EngsundNichlas HardtAlexander Reichenberg,4,6,Carl Mattsson,Juhani Tyrväinen,Jesper Sellgren,Joel LassinanttiGK,Daniel Sondell,NA,Simon Despres,Arsi Piispanen,Tyler Kelleher,Filiph Engsund,Nichlas Hardt,Alexander Reichenberg
441843,2019-09-28,IK Oskarshamn,Luleå HF,Austin Farley,Petter Emanuelsson,Nils Lundkvist,5v5,EV,Luleå HF,6,IK Oskarshamn,6,Petter EmanuelssonJack ConnollyNils LundkvistOscar EngsundJoel LassinanttiGKAustin Farley,Pontus NäsénSimon DespresJoakim ThelinTex WilliamssonGKFilip SveningssonAlexander Reichenberg,5,5,Petter Emanuelsson,Jack Connolly,Nils Lundkvist,Oscar Engsund,Joel LassinanttiGK,Austin Farley,Pontus Näsén,Simon Despres,Joakim Thelin,Tex WilliamssonGK,Filip Sveningsson,Alexander Reichenberg
441846,2019-10-03,IK Oskarshamn,HV 71,Markus Lauridsen,Filip Sandberg,Anthony Camara,5v5,EV,HV 71,8,IK Oskarshamn,7,Markus LauridsenNils AnderssonFilip SandbergChristian SandbergAnthony CamaraHugo AlnefeltGK,Jesper DahlrothIsak PantzareRok TicarJohannes SalmonssonTex WilliamssonGKAlexander Reichenberg,5,5,Markus Lauridsen,Nils Andersson,Filip Sandberg,Christian Sandberg,Anthony Camara,Hugo AlnefeltGK,Jesper Dahlroth,Isak Pantzare,Rok Ticar,Johannes Salmonsson,Tex WilliamssonGK,Alexander Reichenberg
441846,2019-10-03,IK Oskarshamn,HV 71,Anthony Camara,Johannes Kinnvall,Filip Sandberg,5v5,EV,HV 71,8,IK Oskarshamn,7,Filip SandbergChristian SandbergJohannes KinnvallAnthony CamaraHugo AlnefeltGKEric Martinsson,Rok TicarJohannes SalmonssonHenrik NilssonJohan AlmTex WilliamssonGKAlexander Reichenberg,5,5,Filip Sandberg,Christian Sandberg,Johannes Kinnvall,Anthony Camara,Hugo AlnefeltGK,Eric Martinsson,Rok Ticar,Johannes Salmonsson,Henrik Nilsson,Johan Alm,Tex WilliamssonGK,Alexander Reichenberg
441853,2019-10-05,Färjestad BK,IK Oskarshamn,Daniel Viksten,Oskar Bäck,,5v5,EV,Färjestad BK,8,IK Oskarshamn,8,Daniel VikstenJonathon BlumOskar BäckCarl JakobssonAlbert JohanssonArvid HolmGK,Jesper DahlrothIsak PantzareJoakim ThelinGustaf FranzénTex WilliamssonGKAlexander Reichenberg,5,5,Daniel Viksten,Jonathon Blum,Oskar Bäck,Carl Jakobsson,Albert Johansson,Arvid HolmGK,Jesper Dahlroth,Isak Pantzare,Joakim Thelin,Gustaf Franzén,Tex WilliamssonGK,Alexander Reichenberg
441853,2019-10-05,Färjestad BK,IK Oskarshamn,Victor Ejdsell,Linus Johansson,,5v5,EV,Färjestad BK,8,IK Oskarshamn,8,Jens WestinVictor EjdsellPer ÅslundJonathon BlumLinus JohanssonArvid HolmGK,Isak PantzareRok TicarJohannes SalmonssonFredrik Petterson-WentzelGKEmil WahlbergAlexander Reichenberg,5,5,Jens Westin,Victor Ejdsell,Per Åslund,Jonathon Blum,Linus Johansson,Arvid HolmGK,Isak Pantzare,Rok Ticar,Johannes Salmonsson,Fredrik Petterson-WentzelGK,Emil Wahlberg,Alexander Reichenberg
441873,2019-10-17,Brynäs IF,IK Oskarshamn,Linus Ölund,Victor Söderström,Nicklas Danielsson,5v5,EV,Brynäs IF,10,IK Oskarshamn,11,Lukas KilströmVictor SöderströmAnton RödinJoacim ErikssonGKLinus ÖlundNicklas Danielsson,Pontus NäsénSimon DespresPontus NetterbergFiliph EngsundFredrik Petterson-WentzelGKAlexander Reichenberg,5,5,Lukas Kilström,Victor Söderström,Anton Rödin,Joacim ErikssonGK,Linus Ölund,Nicklas Danielsson,Pontus Näsén,Simon Despres,Pontus Netterberg,Filiph Engsund,Fredrik Petterson-WentzelGK,Alexander Reichenberg
441882,2019-10-19,IK Oskarshamn,Linköping HC,Andrew Gordon,Jimmy Andersson,Jonas Holös,5v5,EV,Linköping HC,12,IK Oskarshamn,12,William Worge KreüAndrew GordonHampus LarssonJaakko RissanenJonas GustavssonGKJimmy Andersson,Jesper DahlrothArsi PiispanenJohannes SalmonssonHenrik NilssonTex WilliamssonGKAlexander Reichenberg,5,5,William Worge Kreü,Andrew Gordon,Hampus Larsson,Jaakko Rissanen,Jonas GustavssonGK,Jimmy Andersson,Jesper Dahlroth,Arsi Piispanen,Johannes Salmonsson,Henrik Nilsson,Tex WilliamssonGK,Alexander Reichenberg
441904,2019-10-31,IK Oskarshamn,Brynäs IF,Daniel Mannberg,Victor Söderström,Jonathan Sigalet,5v5,EV,Brynäs IF,15,IK Oskarshamn,15,Victor SöderströmEmil MolinJoacim ErikssonGKTomi SallinenJonathan SigaletDaniel Mannberg,Pontus NetterbergJohannes SalmonssonHenrik NilssonEmil WahlbergTex WilliamssonGKAlexander Reichenberg,5,5,Victor Söderström,Emil Molin,Joacim ErikssonGK,Tomi Sallinen,Jonathan Sigalet,Daniel Mannberg,Pontus Netterberg,Johannes Salmonsson,Henrik Nilsson,Emil Wahlberg,Tex WilliamssonGK,Alexander Reichenberg
441910,2019-11-02,HV 71,IK Oskarshamn,Juuso Ikonen,Eric Martinsson,Johannes Kinnvall,6v5,Goalie Pulled,HV 71,16,IK Oskarshamn,16,Oscar SundhJohannes KinnvallJohan JohnssonJuuso IkonenEric MartinssonLinus Fröberg,Pontus NetterbergJohannes SalmonssonHenrik NilssonChristian LindbergTex WilliamssonGKAlexander Reichenberg,6,5,Oscar Sundh,Johannes Kinnvall,Johan Johnsson,Juuso Ikonen,Eric Martinsson,Linus Fröberg,Pontus Netterberg,Johannes Salmonsson,Henrik Nilsson,Christian Lindberg,Tex WilliamssonGK,Alexander Reichenberg
441934,2019-11-21,IK Oskarshamn,Skellefteå AIK,Jonatan Berggren,Jonathan Pudas,Joakim Lindström,5v5,EV,Skellefteå AIK,19,IK Oskarshamn,19,Philip BrobergJoakim LindströmTom PyattJonatan BerggrenMantas ArmalisGKJonathan Pudas,Jesper DahlrothPontus NetterbergHenrik NilssonNichlas HardtFredrik Petterson-WentzelGKAlexander Reichenberg,5,5,Philip Broberg,Joakim Lindström,Tom Pyatt,Jonatan Berggren,Mantas ArmalisGK,Jonathan Pudas,Jesper Dahlroth,Pontus Netterberg,Henrik Nilsson,Nichlas Hardt,Fredrik Petterson-WentzelGK,Alexander Reichenberg
442109,2020-01-18,Luleå HF,HV 71,Joakim Andersson,Juuso Ikonen,Johannes Kinnvall,5v5,EV,HV 71,33,Luleå HF,34,Markus LauridsenMartin ThörnbergJoakim AnderssonJohannes KinnvallJonas GunnarssonGKJuuso Ikonen,Petter EmanuelssonJack ConnollyRadek MuzikErik GustafssonJoel LassinanttiGKYohann Auvitu,5,5,Markus Lauridsen,Martin Thörnberg,Joakim Andersson,Johannes Kinnvall,Jonas GunnarssonGK,Juuso Ikonen,Petter Emanuelsson,Jack Connolly,Radek Muzik,Erik Gustafsson,Joel LassinanttiGK,Yohann Auvitu
441806,2019-09-14,Luleå HF,Växjö Lakers HC,Karl Fabricius,Erik Gustafsson,Nils Lundkvist,5v5,EV,Luleå HF,1,Växjö Lakers HC,1,Einar EmanuelssonJonas BerglundNils LundkvistErik GustafssonJoel LassinanttiGKKarl Fabricius,Matthew BodieOliver BohmMarcus DavidssonPontus HolmbergViktor AndrénGKFredrik Karlström,5,5,Einar Emanuelsson,Jonas Berglund,Nils Lundkvist,Erik Gustafsson,Joel LassinanttiGK,Karl Fabricius,Matthew Bodie,Oliver Bohm,Marcus Davidsson,Pontus Holmberg,Viktor AndrénGK,Fredrik Karlström
