gameid,date,home_team,away_team,goal,primary_assist,secondary_assist,game_situation,game_situation_general,gf_team,gf_team_game_number,ga_team,ga_team_game_number,GF_names,GA_names,GF_skaters,GA_skaters,GF1_name,GF2_name,GF3_name,GF4_name,GF5_name,GF6_name,GA1_name,GA2_name,GA3_name,GA4_name,GA5_name,GA6_name
442109,2020-01-18,Luleå HF,HV 71,Jonas Berglund,Nils Lundkvist,Erik Gustafsson,5v5,EV,Luleå HF,34,HV 71,33,Jonas BerglundNils LundkvistErik GustafssonJoel LassinanttiGKKarl FabriciusKonstantin Komarek,Markus LauridsenOscar SundhFilip SandbergJesper WilliamssonJohan JohnssonHugo AlnefeltGK,5,5,Jonas Berglund,Nils Lundkvist,Erik Gustafsson,Joel LassinanttiGK,Karl Fabricius,Konstantin Komarek,Markus Lauridsen,Oscar Sundh,Filip Sandberg,Jesper Williamsson,Johan Johnsson,Hugo AlnefeltGK
441816,2019-09-17,Växjö Lakers HC,Djurgårdens IF,Alexander Holtz,,,5v5,EV,Djurgårdens IF,2,Växjö Lakers HC,2,Sebastian StrandbergLinus HultströmRobin NorellMichael HagaAlexander HoltzNiklas SvedbergGK,Tim ErixonMarcus SylvegårdFilip CederqvistViktor FasthGKPeter AnderssonErik Josefsson,5,5,Sebastian Strandberg,Linus Hultström,Robin Norell,Michael Haga,Alexander Holtz,Niklas SvedbergGK,Tim Erixon,Marcus Sylvegård,Filip Cederqvist,Viktor FasthGK,Peter Andersson,Erik Josefsson
441819,2019-09-19,Färjestad BK,Växjö Lakers HC,Ville Leskinen,Victor Ejdsell,Vojtech Mozik,5v5,EV,Färjestad BK,3,Växjö Lakers HC,3,Ville LeskinenDaniel VikstenVictor EjdsellMarkus SvenssonGKLinus JohanssonVojtech Mozik,Linus HögbergBrendan ShinniminViktor FasthGKPeter AnderssonDaniel RahimiErik Josefsson,5,5,Ville Leskinen,Daniel Viksten,Victor Ejdsell,Markus SvenssonGK,Linus Johansson,Vojtech Mozik,Linus Högberg,Brendan Shinnimin,Viktor FasthGK,Peter Andersson,Daniel Rahimi,Erik Josefsson
441830,2019-09-21,Växjö Lakers HC,Skellefteå AIK,Andreas Wingerli,,,5v5,EV,Skellefteå AIK,4,Växjö Lakers HC,4,Niclas BurströmPetter GranbergAdam PetterssonAndreas WingerliGustaf LindvallGKJonatan Berggren,Linus HögbergMarcus SylvegårdFilip CederqvistViktor AndrénGKDaniel RahimiErik Josefsson,5,5,Niclas Burström,Petter Granberg,Adam Pettersson,Andreas Wingerli,Gustaf LindvallGK,Jonatan Berggren,Linus Högberg,Marcus Sylvegård,Filip Cederqvist,Viktor AndrénGK,Daniel Rahimi,Erik Josefsson
441851,2019-10-03,Växjö Lakers HC,IF Malmö Redhawks,Jesper Jensen Aabo,,,5v6ENG,ENG,IF Malmö Redhawks,6,Växjö Lakers HC,7,Lars BryggmanChristoffer ForsbergNiklas ArellJesper Jensen AaboFredrik HändemarkOscar AlsenfeltGK,Matthew BodieRichard GyngeEmil PetterssonJakob Forsbacka-KarlssonRoman HorakErik Josefsson,5,6,Lars Bryggman,Christoffer Forsberg,Niklas Arell,Jesper Jensen Aabo,Fredrik Händemark,Oscar AlsenfeltGK,Matthew Bodie,Richard Gynge,Emil Pettersson,Jakob Forsbacka-Karlsson,Roman Horak,Erik Josefsson
441864,2019-10-10,Örebro HK,Växjö Lakers HC,Mathias Bromé,,,5v5,EV,Örebro HK,9,Växjö Lakers HC,9,Rasmus RissanenSakari SalminenAaron IrvingDominik FurchGKMathias BroméRyan Stoa,Tim ErixonMarcus DavidssonBrendan ShinniminViktor FasthGKDavid BernhardtErik Josefsson,5,5,Rasmus Rissanen,Sakari Salminen,Aaron Irving,Dominik FurchGK,Mathias Bromé,Ryan Stoa,Tim Erixon,Marcus Davidsson,Brendan Shinnimin,Viktor FasthGK,David Bernhardt,Erik Josefsson
441889,2019-10-24,HV 71,Växjö Lakers HC,Nils Andersson,Joakim Andersson,Markus Lauridsen,5v5,EV,HV 71,13,Växjö Lakers HC,13,Markus LauridsenNils AnderssonOscar SundhJoakim AnderssonJonas GunnarssonGKJuuso Ikonen,Oliver BohmMartin LundbergLudvig NilssonViktor AndrénGKDaniel RahimiErik Josefsson,5,5,Markus Lauridsen,Nils Andersson,Oscar Sundh,Joakim Andersson,Jonas GunnarssonGK,Juuso Ikonen,Oliver Bohm,Martin Lundberg,Ludvig Nilsson,Viktor AndrénGK,Daniel Rahimi,Erik Josefsson
441858,2019-10-31,Växjö Lakers HC,Leksands IF,Fredrik Forsberg,,,5v5,EV,Leksands IF,15,Växjö Lakers HC,15,Johan FranssonFredrik ForsbergDaniel Olsson-TrkuljaMattias KarlssonMarek HrivikAxel BrageGK,Linus HögbergRichard GyngeIlari MelartLudvig NilssonViktor AndrénGKErik Josefsson,5,5,Johan Fransson,Fredrik Forsberg,Daniel Olsson-Trkulja,Mattias Karlsson,Marek Hrivik,Axel BrageGK,Linus Högberg,Richard Gynge,Ilari Melart,Ludvig Nilsson,Viktor AndrénGK,Erik Josefsson
441949,2019-11-28,Växjö Lakers HC,HV 71,Simon Önerud,Linus Fröberg,,5v5,EV,HV 71,21,Växjö Lakers HC,21,Markus LauridsenNils AnderssonMartin ThörnbergSimon ÖnerudJonas GunnarssonGKLinus Fröberg,Oliver BohmLinus HögbergJakob Forsbacka-KarlssonErik KällgrenGKLudvig NilssonErik Josefsson,5,5,Markus Lauridsen,Nils Andersson,Martin Thörnberg,Simon Önerud,Jonas GunnarssonGK,Linus Fröberg,Oliver Bohm,Linus Högberg,Jakob Forsbacka-Karlsson,Erik KällgrenGK,Ludvig Nilsson,Erik Josefsson
441804,2019-09-14,Färjestad BK,Örebro HK,Christopher Mastomäki,Gustav Backström,,5v5,EV,Örebro HK,1,Färjestad BK,1,Gustav BackströmStefan WargMarcus WeinstockChristopher MastomäkiGlenn GustafssonDominik FurchGK,Johan IvarssonGustav RydahlPer ÅslundMarkus SvenssonGKSebastian ErixonJohan Ryno,5,5,Gustav Backström,Stefan Warg,Marcus Weinstock,Christopher Mastomäki,Glenn Gustafsson,Dominik FurchGK,Johan Ivarsson,Gustav Rydahl,Per Åslund,Markus SvenssonGK,Sebastian Erixon,Johan Ryno
441804,2019-09-14,Färjestad BK,Örebro HK,Sakari Salminen,Kristian Näkyvä,,4v5,SH,Örebro HK,1,Färjestad BK,1,Rasmus RissanenMarcus WeinstockSakari SalminenDominik FurchGKKristian NäkyväNA,Marcus NilssonPer ÅslundJonathon BlumMichael LindqvistMarkus SvenssonGKJohan Ryno,4,5,Rasmus Rissanen,Marcus Weinstock,Sakari Salminen,Dominik FurchGK,Kristian Näkyvä,NA,Marcus Nilsson,Per Åslund,Jonathon Blum,Michael Lindqvist,Markus SvenssonGK,Johan Ryno
441824,2019-09-21,Brynäs IF,Färjestad BK,Tomi Sallinen,Eric Norin,,5v5,EV,Brynäs IF,3,Färjestad BK,4,Lukas KilströmSamuel AsklöfLukas ZetterbergSamuel ErssonGKEric NorinTomi Sallinen,Johan IvarssonVictor EjdsellLukas Ekeståhl-JonssonMichael LindqvistMarkus SvenssonGKJohan Ryno,5,5,Lukas Kilström,Samuel Asklöf,Lukas Zetterberg,Samuel ErssonGK,Eric Norin,Tomi Sallinen,Johan Ivarsson,Victor Ejdsell,Lukas Ekeståhl-Jonsson,Michael Lindqvist,Markus SvenssonGK,Johan Ryno
441839,2019-09-28,Frölunda HC,Färjestad BK,Johan Sundström,Patrik Carlsson,Anders Grönlund,4v5,SH,Frölunda HC,6,Färjestad BK,6,Viktor EkbomAnders GrönlundJohan SundströmJohan MattssonGKPatrik CarlssonNA,Marcus NilssonPer ÅslundJonathon BlumMichael LindqvistMarkus SvenssonGKJohan Ryno,4,5,Viktor Ekbom,Anders Grönlund,Johan Sundström,Johan MattssonGK,Patrik Carlsson,NA,Marcus Nilsson,Per Åslund,Jonathon Blum,Michael Lindqvist,Markus SvenssonGK,Johan Ryno
441839,2019-09-28,Frölunda HC,Färjestad BK,Nicklas Lasu,David Printz,Samuel Fagemo,5v5,EV,Frölunda HC,6,Färjestad BK,6,Gustav BerglundSamuel FagemoNicklas LasuJohan MattssonGKDavid PrintzRyan Lasch,Jens WestinJohan IvarssonVictor EjdsellMichael LindqvistMarkus SvenssonGKJohan Ryno,5,5,Gustav Berglund,Samuel Fagemo,Nicklas Lasu,Johan MattssonGK,David Printz,Ryan Lasch,Jens Westin,Johan Ivarsson,Victor Ejdsell,Michael Lindqvist,Markus SvenssonGK,Johan Ryno
441993,2019-12-28,Färjestad BK,Luleå HF,Emil Larsson,Jack Connolly,Filip Hållander,5v5,EV,Luleå HF,28,Färjestad BK,27,Joonas JalvantiJack ConnollyJoel LassinanttiGKEmil LarssonPontus SjälinFilip Hållander,Jens WestinDaniel VikstenVictor SandbergJonathon BlumMarkus SvenssonGKJohan Ryno,5,5,Joonas Jalvanti,Jack Connolly,Joel LassinanttiGK,Emil Larsson,Pontus Själin,Filip Hållander,Jens Westin,Daniel Viksten,Victor Sandberg,Jonathon Blum,Markus SvenssonGK,Johan Ryno
441901,2019-10-31,Linköping HC,HV 71,Jarno Kärki,Jonas Holös,Max Lindroth,5v5,EV,Linköping HC,15,HV 71,15,Jonas HolösMikael FrycklundAxel OttossonJonas GustavssonGKMax LindrothJarno Kärki,Christoffer PerssonMartin ThörnbergEmil JohanssonJonas GunnarssonGKJohan JohnssonJuuso Ikonen,5,5,Jonas Holös,Mikael Frycklund,Axel Ottosson,Jonas GustavssonGK,Max Lindroth,Jarno Kärki,Christoffer Persson,Martin Thörnberg,Emil Johansson,Jonas GunnarssonGK,Johan Johnsson,Juuso Ikonen
441901,2019-10-31,Linköping HC,HV 71,Jaakko Rissanen,Andrew Gordon,,5v5,EV,Linköping HC,15,HV 71,15,Samuel LofquistAndrew GordonHampus LarssonJaakko RissanenBroc LittleJonas GustavssonGK,Markus LauridsenNils AnderssonOscar SundhJonas GunnarssonGKJohan JohnssonJuuso Ikonen,5,5,Samuel Lofquist,Andrew Gordon,Hampus Larsson,Jaakko Rissanen,Broc Little,Jonas GustavssonGK,Markus Lauridsen,Nils Andersson,Oscar Sundh,Jonas GunnarssonGK,Johan Johnsson,Juuso Ikonen
441980,2019-12-19,Linköping HC,IK Oskarshamn,Jarno Kärki,Dan Pettersson,Samuel Lofquist,5v5,EV,Linköping HC,25,IK Oskarshamn,26,Samuel LofquistAxel OttossonDan PetterssonJonas GustavssonGKEddie LarssonJarno Kärki,Arsi PiispanenTyler KelleherJohannes SalmonssonHenrik NilssonFredrik Petterson-WentzelGKEmil Wahlberg,5,5,Samuel Lofquist,Axel Ottosson,Dan Pettersson,Jonas GustavssonGK,Eddie Larsson,Jarno Kärki,Arsi Piispanen,Tyler Kelleher,Johannes Salmonsson,Henrik Nilsson,Fredrik Petterson-WentzelGK,Emil Wahlberg
441923,2019-11-16,Linköping HC,Djurgårdens IF,Jarno Kärki,Adam Helewka,Jonas Holös,5v5,EV,Linköping HC,18,Djurgårdens IF,19,Jonas HolösHenrik TörnqvistOlle LycksellAdam HelewkaJonas GustavssonGKJarno Kärki,Karri RämöGKLinus HultströmJesper PetterssonAlbin GreweRobin NorellManuel Ågren,5,5,Jonas Holös,Henrik Törnqvist,Olle Lycksell,Adam Helewka,Jonas GustavssonGK,Jarno Kärki,Karri RämöGK,Linus Hultström,Jesper Pettersson,Albin Grewe,Robin Norell,Manuel Ågren
441981,2019-12-19,IF Malmö Redhawks,Djurgårdens IF,Max Görtz,Axel Wemmenborn,,5v5,EV,IF Malmö Redhawks,26,Djurgårdens IF,26,Axel WemmenbornMatias LassenMax GörtzChristoffer ForsbergJesper Jensen AaboOscar AlsenfeltGK,Marcus HögströmSimon JohanssonSebastian StrandbergKarri RämöGKJacob JosefsonManuel Ågren,5,5,Axel Wemmenborn,Matias Lassen,Max Görtz,Christoffer Forsberg,Jesper Jensen Aabo,Oscar AlsenfeltGK,Marcus Högström,Simon Johansson,Sebastian Strandberg,Karri RämöGK,Jacob Josefson,Manuel Ågren
441991,2019-12-26,Växjö Lakers HC,Djurgårdens IF,Richard Gynge,Casey Bailey,Miika Koivisto,5v5,EV,Växjö Lakers HC,27,Djurgårdens IF,27,Richard GyngeIlari MelartEmil PetterssonCasey BaileyViktor AndrénGKMiika Koivisto,Henrik ErikssonKarri RämöGKLinus HultströmJacob JosefsonTom NilssonManuel Ågren,5,5,Richard Gynge,Ilari Melart,Emil Pettersson,Casey Bailey,Viktor AndrénGK,Miika Koivisto,Henrik Eriksson,Karri RämöGK,Linus Hultström,Jacob Josefson,Tom Nilsson,Manuel Ågren
441991,2019-12-26,Växjö Lakers HC,Djurgårdens IF,Ilari Melart,Miika Koivisto,Roman Horak,5v5,EV,Växjö Lakers HC,27,Djurgårdens IF,27,Marcus DavidssonIlari MelartRoman HorakBrendan ShinniminViktor AndrénGKMiika Koivisto,Simon JohanssonPatrik BerglundSebastian StrandbergKarri RämöGKRobin NorellManuel Ågren,5,5,Marcus Davidsson,Ilari Melart,Roman Horak,Brendan Shinnimin,Viktor AndrénGK,Miika Koivisto,Simon Johansson,Patrik Berglund,Sebastian Strandberg,Karri RämöGK,Robin Norell,Manuel Ågren
441805,2019-09-14,Frölunda HC,Brynäs IF,Adam Brodecki,Tomi Sallinen,,5v5,EV,Brynäs IF,1,Frölunda HC,1,Josef IngmanAdam BrodeckiLukas ZetterbergJoacim ErikssonGKTomi SallinenJonathan Sigalet,Max FribergAnders GrönlundJoel LundqvistJoel MustonenNiklas RubinGKJulius Bergman,5,5,Josef Ingman,Adam Brodecki,Lukas Zetterberg,Joacim ErikssonGK,Tomi Sallinen,Jonathan Sigalet,Max Friberg,Anders Grönlund,Joel Lundqvist,Joel Mustonen,Niklas RubinGK,Julius Bergman
441835,2019-09-26,Skellefteå AIK,Frölunda HC,Andreas Wingerli,Filip Berglund,Jonatan Berggren,5v5,EV,Skellefteå AIK,5,Frölunda HC,5,Philip BrobergFilip BerglundAdam PetterssonAndreas WingerliGustaf LindvallGKJonatan Berggren,Nicklas LasuNiklas RubinGKRhett RakhshaniMats Rosseli OlsenDavid PrintzJulius Bergman,5,5,Philip Broberg,Filip Berglund,Adam Pettersson,Andreas Wingerli,Gustaf LindvallGK,Jonatan Berggren,Nicklas Lasu,Niklas RubinGK,Rhett Rakhshani,Mats Rosseli Olsen,David Printz,Julius Bergman
441903,2019-10-31,IF Malmö Redhawks,Frölunda HC,Carl Persson,Johan Olofsson,Niklas Arell,5v5,EV,IF Malmö Redhawks,15,Frölunda HC,15,Johan OlofssonChristoffer ForsbergLars VoldenGKNiklas ArellJesper Jensen AaboCarl Persson,Karl StolleryNicklas LasuJohan MattssonGKRhett RakhshaniMats Rosseli OlsenJulius Bergman,5,5,Johan Olofsson,Christoffer Forsberg,Lars VoldenGK,Niklas Arell,Jesper Jensen Aabo,Carl Persson,Karl Stollery,Nicklas Lasu,Johan MattssonGK,Rhett Rakhshani,Mats Rosseli Olsen,Julius Bergman
441977,2019-12-17,Växjö Lakers HC,Frölunda HC,Pontus Holmberg,Erik Josefsson,Ilari Melart,5v5,EV,Växjö Lakers HC,25,Frölunda HC,25,Ilari MelartPontus HolmbergViktor FasthGKLudvig NilssonMiika KoivistoErik Josefsson,Joel LundqvistJohan MattssonGKRhett RakhshaniMats Rosseli OlsenDavid PrintzJulius Bergman,5,5,Ilari Melart,Pontus Holmberg,Viktor FasthGK,Ludvig Nilsson,Miika Koivisto,Erik Josefsson,Joel Lundqvist,Johan MattssonGK,Rhett Rakhshani,Mats Rosseli Olsen,David Printz,Julius Bergman
441878,2019-10-17,IF Malmö Redhawks,HV 71,Juuso Ikonen,Christoffer Törngren,,5v5,EV,HV 71,11,IF Malmö Redhawks,10,Didrik StrömbergEmil JohanssonJoakim AnderssonHugo AlnefeltGKJuuso IkonenChristoffer Törngren,Malte SetkovCarl-Johan LerbyLars BryggmanEmil MolinLars VoldenGKFredrik Händemark,5,5,Didrik Strömberg,Emil Johansson,Joakim Andersson,Hugo AlnefeltGK,Juuso Ikonen,Christoffer Törngren,Malte Setkov,Carl-Johan Lerby,Lars Bryggman,Emil Molin,Lars VoldenGK,Fredrik Händemark
441911,2019-11-02,IF Malmö Redhawks,Leksands IF,Thomas Valkvae-Olsen,Patrik Zackrisson,,5v6ENG,ENG,Leksands IF,16,IF Malmö Redhawks,16,Johan FranssonMattias KarlssonMattias RitolaThomas Valkvae-OlsenLinus PerssonAxel BrageGK,Marcus BjörkLars BryggmanMatias MyttynenTobias EkbergEmil SylvegårdFredrik Händemark,5,6,Johan Fransson,Mattias Karlsson,Mattias Ritola,Thomas Valkvae-Olsen,Linus Persson,Axel BrageGK,Marcus Björk,Lars Bryggman,Matias Myttynen,Tobias Ekberg,Emil Sylvegård,Fredrik Händemark
441933,2019-11-21,IF Malmö Redhawks,Växjö Lakers HC,Erik Josefsson,Brendan Shinnimin,,4v5,SH,Växjö Lakers HC,19,IF Malmö Redhawks,19,Oliver BohmBrendan ShinniminViktor AndrénGKDaniel RahimiErik JosefssonNA,Max GörtzLars VoldenGKMatias MyttynenJesper Jensen AaboEmil SylvegårdFredrik Händemark,4,5,Oliver Bohm,Brendan Shinnimin,Viktor AndrénGK,Daniel Rahimi,Erik Josefsson,NA,Max Görtz,Lars VoldenGK,Matias Myttynen,Jesper Jensen Aabo,Emil Sylvegård,Fredrik Händemark
441955,2019-11-30,Skellefteå AIK,IF Malmö Redhawks,Jonathan Pudas,Robin Alvarez,Linus Lindström,5v5,EV,Skellefteå AIK,22,IF Malmö Redhawks,22,Philip BrobergLinus LindströmRobin AlvarezGustaf LindvallGKJonathan PudasRickard Hugg,Marcus BjörkFrederik StormLars BryggmanLars VoldenGKJesper Jensen AaboFredrik Händemark,5,5,Philip Broberg,Linus Lindström,Robin Alvarez,Gustaf LindvallGK,Jonathan Pudas,Rickard Hugg,Marcus Björk,Frederik Storm,Lars Bryggman,Lars VoldenGK,Jesper Jensen Aabo,Fredrik Händemark
441808,2019-09-14,Skellefteå AIK,IK Oskarshamn,Niclas Burström,Jonatan Berggren,,5v5,EV,Skellefteå AIK,1,IK Oskarshamn,1,Niclas BurströmJacob AnderssonAlbin SundsvikGustaf LindvallGKJonatan BerggrenRickard Hugg,Pontus NäsénSimon DespresJoakim ThelinMarkus ModigsFredrik Petterson-WentzelGKRobin Söderqvist,5,5,Niclas Burström,Jacob Andersson,Albin Sundsvik,Gustaf LindvallGK,Jonatan Berggren,Rickard Hugg,Pontus Näsén,Simon Despres,Joakim Thelin,Markus Modigs,Fredrik Petterson-WentzelGK,Robin Söderqvist
441873,2019-10-17,Brynäs IF,IK Oskarshamn,Greg Scott,Anton Rödin,Eric Norin,5v5,EV,Brynäs IF,10,IK Oskarshamn,11,Lukas KilströmAnton RödinJoacim ErikssonGKGreg ScottEric NorinJaedon Descheneau,Joakim ThelinJohn DahlströmHenrik NilssonChristian LindbergFredrik Petterson-WentzelGKRobin Söderqvist,5,5,Lukas Kilström,Anton Rödin,Joacim ErikssonGK,Greg Scott,Eric Norin,Jaedon Descheneau,Joakim Thelin,John Dahlström,Henrik Nilsson,Christian Lindberg,Fredrik Petterson-WentzelGK,Robin Söderqvist
441895,2019-10-26,Djurgårdens IF,IK Oskarshamn,Linus Hultström,Sebastian Strandberg,Patrik Berglund,5v5,EV,Djurgårdens IF,14,IK Oskarshamn,14,Patrik BerglundSebastian StrandbergLinus HultströmRobin NorellAlexander HoltzNiklas SvedbergGK,Pontus NäsénSimon DespresJoakim ThelinJohn DahlströmFredrik Petterson-WentzelGKRobin Söderqvist,5,5,Patrik Berglund,Sebastian Strandberg,Linus Hultström,Robin Norell,Alexander Holtz,Niklas SvedbergGK,Pontus Näsén,Simon Despres,Joakim Thelin,John Dahlström,Fredrik Petterson-WentzelGK,Robin Söderqvist
441895,2019-10-26,Djurgårdens IF,IK Oskarshamn,Olle Alsing,,,5v5,EV,Djurgårdens IF,14,IK Oskarshamn,14,Niclas BergforsPatrik BerglundSebastian StrandbergLinus HultströmOlle AlsingNiklas SvedbergGK,Joakim ThelinJohn DahlströmHenrik NilssonFredrik Petterson-WentzelGKEmil WahlbergRobin Söderqvist,5,5,Niclas Bergfors,Patrik Berglund,Sebastian Strandberg,Linus Hultström,Olle Alsing,Niklas SvedbergGK,Joakim Thelin,John Dahlström,Henrik Nilsson,Fredrik Petterson-WentzelGK,Emil Wahlberg,Robin Söderqvist
441910,2019-11-02,HV 71,IK Oskarshamn,Simon Önerud,Linus Fröberg,Emil Johansson,5v5,EV,HV 71,16,IK Oskarshamn,16,Didrik StrömbergMartin ThörnbergSimon ÖnerudEmil JohanssonJonas GunnarssonGKLinus Fröberg,Nichlas TorpSimon DespresJoakim ThelinJohn DahlströmFredrik Petterson-WentzelGKRobin Söderqvist,5,5,Didrik Strömberg,Martin Thörnberg,Simon Önerud,Emil Johansson,Jonas GunnarssonGK,Linus Fröberg,Nichlas Torp,Simon Despres,Joakim Thelin,John Dahlström,Fredrik Petterson-WentzelGK,Robin Söderqvist
441934,2019-11-21,IK Oskarshamn,Skellefteå AIK,Adam Pettersson,Jonathan Pudas,Jesper Frödén,5v5,ENG,Skellefteå AIK,19,IK Oskarshamn,19,Petter GranbergAdam PetterssonAndreas WingerliJesper FrödénMantas ArmalisGKJonathan Pudas,Pontus NetterbergJohn DahlströmHenrik NilssonFredrik Petterson-WentzelGKEmil WahlbergRobin Söderqvist,5,5,Petter Granberg,Adam Pettersson,Andreas Wingerli,Jesper Frödén,Mantas ArmalisGK,Jonathan Pudas,Pontus Netterberg,John Dahlström,Henrik Nilsson,Fredrik Petterson-WentzelGK,Emil Wahlberg,Robin Söderqvist
441985,2019-12-26,Brynäs IF,IK Oskarshamn,Nicklas Danielsson,Jaedon Descheneau,Jonathan Sigalet,5v5,EV,Brynäs IF,27,IK Oskarshamn,27,Josef IngmanSamuel ErssonGKTomi SallinenJonathan SigaletNicklas DanielssonJaedon Descheneau,Simon DespresJoakim ThelinNichlas TorpNichlas HardtFredrik Petterson-WentzelGKRobin Söderqvist,5,5,Josef Ingman,Samuel ErssonGK,Tomi Sallinen,Jonathan Sigalet,Nicklas Danielsson,Jaedon Descheneau,Simon Despres,Joakim Thelin,Nichlas Torp,Nichlas Hardt,Fredrik Petterson-WentzelGK,Robin Söderqvist
442005,2019-12-30,Växjö Lakers HC,IK Oskarshamn,Ludvig Nilsson,Linus Högberg,,5v5,EV,Växjö Lakers HC,29,IK Oskarshamn,29,Linus HögbergFilip CederqvistLudvig NilssonViktor AndrénGKDaniel RahimiErik Josefsson,Jesper DahlrothJoakim ThelinNichlas TorpNichlas HardtFredrik Petterson-WentzelGKRobin Söderqvist,5,5,Linus Högberg,Filip Cederqvist,Ludvig Nilsson,Viktor AndrénGK,Daniel Rahimi,Erik Josefsson,Jesper Dahlroth,Joakim Thelin,Nichlas Torp,Nichlas Hardt,Fredrik Petterson-WentzelGK,Robin Söderqvist
442005,2019-12-30,Växjö Lakers HC,IK Oskarshamn,Erik Josefsson,Pontus Holmberg,Ludvig Nilsson,5v5,EV,Växjö Lakers HC,29,IK Oskarshamn,29,Oliver BohmLinus HögbergPontus HolmbergLudvig NilssonViktor AndrénGKErik Josefsson,Jesper DahlrothPontus NetterbergJohn DahlströmFredrik Petterson-WentzelGKOskar NilssonRobin Söderqvist,5,5,Oliver Bohm,Linus Högberg,Pontus Holmberg,Ludvig Nilsson,Viktor AndrénGK,Erik Josefsson,Jesper Dahlroth,Pontus Netterberg,John Dahlström,Fredrik Petterson-WentzelGK,Oskar Nilsson,Robin Söderqvist
442092,2020-01-11,Färjestad BK,IK Oskarshamn,Jesper Olofsson,,,5v5,EV,Färjestad BK,31,IK Oskarshamn,32,Lukas Ekeståhl-JonssonJonathon BlumLinus JohanssonVojtech MozikArvid HolmGKJesper Olofsson,Simon DespresJoakim ThelinJohn DahlströmFredrik Petterson-WentzelGKOskar NilssonRobin Söderqvist,5,5,Lukas Ekeståhl-Jonsson,Jonathon Blum,Linus Johansson,Vojtech Mozik,Arvid HolmGK,Jesper Olofsson,Simon Despres,Joakim Thelin,John Dahlström,Fredrik Petterson-WentzelGK,Oskar Nilsson,Robin Söderqvist
442092,2020-01-11,Färjestad BK,IK Oskarshamn,Linus Arnesson,Marcus Nilsson,Gustav Rydahl,5v5,EV,Färjestad BK,31,IK Oskarshamn,32,Johan IvarssonMarcus NilssonDaniel VikstenGustav RydahlLinus ArnessonArvid HolmGK,Mathew BodieSimon DespresJoakim ThelinJohn DahlströmFredrik Petterson-WentzelGKRobin Söderqvist,5,5,Johan Ivarsson,Marcus Nilsson,Daniel Viksten,Gustav Rydahl,Linus Arnesson,Arvid HolmGK,Mathew Bodie,Simon Despres,Joakim Thelin,John Dahlström,Fredrik Petterson-WentzelGK,Robin Söderqvist
441901,2019-10-31,Linköping HC,HV 71,Henrik Törnqvist,Anton Mylläri,Olle Lycksell,5v5,EV,Linköping HC,15,HV 71,15,Jonas HolösMikael FrycklundHenrik TörnqvistOlle LycksellJonas GustavssonGKAnton Mylläri,Simon ÖnerudOscar SundhChristian SandbergJohannes KinnvallJonas GunnarssonGKEric Martinsson,5,5,Jonas Holös,Mikael Frycklund,Henrik Törnqvist,Olle Lycksell,Jonas GustavssonGK,Anton Mylläri,Simon Önerud,Oscar Sundh,Christian Sandberg,Johannes Kinnvall,Jonas GunnarssonGK,Eric Martinsson
441937,2019-11-26,HV 71,Örebro HK,Shane Harper,,,5v6ENG,ENG,Örebro HK,20,HV 71,20,Stefan WargShane HarperLudvig RensfeldtDominik FurchGKKristian NäkyväJoonas Rask,Filip SandbergAxel HolmströmAlexander BergströmAnthony CamaraJuuso IkonenEric Martinsson,5,6,Stefan Warg,Shane Harper,Ludvig Rensfeldt,Dominik FurchGK,Kristian Näkyvä,Joonas Rask,Filip Sandberg,Axel Holmström,Alexander Bergström,Anthony Camara,Juuso Ikonen,Eric Martinsson
441958,2019-12-05,HV 71,Luleå HF,Einar Emanuelsson,Juhani Tyrväinen,Oscar Engsund,5v5,EV,Luleå HF,23,HV 71,23,Einar EmanuelssonJuhani TyrväinenDavid RautioGKOscar EngsundPontus SjälinRobin Kovacs,Filip SandbergLinus SandinChristian SandbergJohannes KinnvallJonas GunnarssonGKEric Martinsson,5,5,Einar Emanuelsson,Juhani Tyrväinen,David RautioGK,Oscar Engsund,Pontus Själin,Robin Kovacs,Filip Sandberg,Linus Sandin,Christian Sandberg,Johannes Kinnvall,Jonas GunnarssonGK,Eric Martinsson
442000,2019-12-26,HV 71,Leksands IF,Jonas Ahnelöv,,,5v6ENG,ENG,Leksands IF,27,HV 71,28,Marcus KarlbergDaniel Olsson-TrkuljaLinus PerssonMattias GöranssonJanne JuvonenGKJonas Ahnelöv,Oscar SundhFilip SandbergChristian SandbergAlexander BergströmJohannes KinnvallEric Martinsson,5,6,Marcus Karlberg,Daniel Olsson-Trkulja,Linus Persson,Mattias Göransson,Janne JuvonenGK,Jonas Ahnelöv,Oscar Sundh,Filip Sandberg,Christian Sandberg,Alexander Bergström,Johannes Kinnvall,Eric Martinsson
441986,2019-12-30,HV 71,Frölunda HC,Joel Mustonen,Theodor Lennström,David Printz,5v5,EV,Frölunda HC,29,HV 71,30,Max FribergJoel LundqvistTheodor LennströmJoel MustonenNiklas RubinGKDavid Printz,Simon ÖnerudAxel HolmströmJohannes KinnvallAnthony CamaraJonas GunnarssonGKEric Martinsson,5,5,Max Friberg,Joel Lundqvist,Theodor Lennström,Joel Mustonen,Niklas RubinGK,David Printz,Simon Önerud,Axel Holmström,Johannes Kinnvall,Anthony Camara,Jonas GunnarssonGK,Eric Martinsson
442086,2020-01-09,Djurgårdens IF,HV 71,Alexander Holtz,Olle Alsing,Patrik Berglund,5v5,EV,Djurgårdens IF,31,HV 71,31,Patrik BerglundDick AxelssonOlle AlsingTom NilssonAlexander HoltzNiklas SvedbergGK,Christoffer PerssonOscar SundhFilip SandbergChristian SandbergJonas GunnarssonGKEric Martinsson,5,5,Patrik Berglund,Dick Axelsson,Olle Alsing,Tom Nilsson,Alexander Holtz,Niklas SvedbergGK,Christoffer Persson,Oscar Sundh,Filip Sandberg,Christian Sandberg,Jonas GunnarssonGK,Eric Martinsson
442086,2020-01-09,Djurgårdens IF,HV 71,Dick Axelsson,Patrik Berglund,Alexander Holtz,5v5,EV,Djurgårdens IF,31,HV 71,31,Patrik BerglundDick AxelssonOlle AlsingTom NilssonAlexander HoltzNiklas SvedbergGK,Oscar SundhFilip SandbergChristian SandbergJohannes KinnvallJonas GunnarssonGKEric Martinsson,5,5,Patrik Berglund,Dick Axelsson,Olle Alsing,Tom Nilsson,Alexander Holtz,Niklas SvedbergGK,Oscar Sundh,Filip Sandberg,Christian Sandberg,Johannes Kinnvall,Jonas GunnarssonGK,Eric Martinsson
442093,2020-01-11,HV 71,Skellefteå AIK,Linus Lindström,Arvid Lundberg,Jonathan Pudas,5v5,EV,Skellefteå AIK,32,HV 71,32,Linus LindströmTuomas KiiskinenGustaf LindvallGKOscar MöllerArvid LundbergJonathan Pudas,Oscar SundhChristian SandbergJesper WilliamssonHugo AlnefeltGKJuuso IkonenEric Martinsson,5,5,Linus Lindström,Tuomas Kiiskinen,Gustaf LindvallGK,Oscar Möller,Arvid Lundberg,Jonathan Pudas,Oscar Sundh,Christian Sandberg,Jesper Williamsson,Hugo AlnefeltGK,Juuso Ikonen,Eric Martinsson
441808,2019-09-14,Skellefteå AIK,IK Oskarshamn,Filiph Engsund,Pontus Netterberg,Simon Despres,5v5,EV,IK Oskarshamn,1,Skellefteå AIK,1,Simon DespresPontus NetterbergJohn DahlströmFiliph EngsundFredrik Petterson-WentzelGKEmil Wahlberg,Adam PetterssonAndreas WingerliGustaf LindvallGKAlbin ErikssonArvid LundbergJonathan Pudas,5,5,Simon Despres,Pontus Netterberg,John Dahlström,Filiph Engsund,Fredrik Petterson-WentzelGK,Emil Wahlberg,Adam Pettersson,Andreas Wingerli,Gustaf LindvallGK,Albin Eriksson,Arvid Lundberg,Jonathan Pudas
441835,2019-09-26,Skellefteå AIK,Frölunda HC,Rhett Rakhshani,David Printz,Nicklas Lasu,5v5,EV,Frölunda HC,5,Skellefteå AIK,5,Nicklas LasuNiklas RubinGKRhett RakhshaniMats Rosseli OlsenDavid PrintzJulius Bergman,Pontus WiderströmGustaf LindvallGKAlbin ErikssonJacob OlofssonArvid LundbergJonathan Pudas,5,5,Nicklas Lasu,Niklas RubinGK,Rhett Rakhshani,Mats Rosseli Olsen,David Printz,Julius Bergman,Pontus Widerström,Gustaf LindvallGK,Albin Eriksson,Jacob Olofsson,Arvid Lundberg,Jonathan Pudas
